"1","19031","Mackey International Inc.: MAC","AIRLINE_ID"
"2","19032","Munz Northern Airlines Inc.: XY","AIRLINE_ID"
"3","19033","Cochise Airlines Inc.: COC","AIRLINE_ID"
"4","19034","Golden Gate Airlines Inc.: GSA","AIRLINE_ID"
"5","19035","Aeromech Inc.: RZZ","AIRLINE_ID"
"6","19036","Golden West Airlines Co.: GLW","AIRLINE_ID"
"7","19037","Puerto Rico Intl Airlines: PRN","AIRLINE_ID"
"8","19038","Air America Inc.: STZ","AIRLINE_ID"
"9","19039","Swift Aire Lines Inc.: SWT","AIRLINE_ID"
"10","19040","American Central Airlines: TSF","AIRLINE_ID"
"11","19041","Valdez Airlines: VEZ","AIRLINE_ID"
"12","19042","Southeast Alaska Airlines: WEB","AIRLINE_ID"
"13","19043","Altair Airlines Inc.: AAR","AIRLINE_ID"
"14","19044","Chitina Air Service: CHI","AIRLINE_ID"
"15","19045","Marco Island Airways Inc.: MRC","AIRLINE_ID"
"16","19046","Caribbean Air Services Inc.: OHZ","AIRLINE_ID"
"17","19047","Sundance Airlines: PRO","AIRLINE_ID"
"18","19048","Seair Alaska Airlines Inc.: SAI","AIRLINE_ID"
"19","19049","Southeast Airlines Inc.: SLZ","AIRLINE_ID"
"20","19050","Alaska Aeronautical Indust.: AAZ","AIRLINE_ID"
"21","19051","Imperial Airlines Inc.: IMP","AIRLINE_ID"
"22","19052","Trans Western Airlines Utah: TWA","AIRLINE_ID"
"23","19053","Wright Airlines Inc.: WRT","AIRLINE_ID"
"24","19054","Presidential Express: COL","AIRLINE_ID"
"25","19055","Mississippi Valley Airlines: MVA","AIRLINE_ID"
"26","19056","Channel Flying Inc.: CHL","AIRLINE_ID"
"27","19057","Rocky Mountain Airways Inc.: JCZ","AIRLINE_ID"
"28","19058","Midstate Airlines Inc.: MIS","AIRLINE_ID"
"29","19059","Sedalia Marshall Boonvl Stg: STG","AIRLINE_ID"
"30","19060","Inlet Airlines: CKI","AIRLINE_ID"
"31","19061","Command Airways Inc.: CMD","AIRLINE_ID"
"32","19062","Emerald Airlines: EMA","AIRLINE_ID"
"33","19063","Orion Air Inc.: ORI","AIRLINE_ID"
"34","19064","Pan Am Express: RAN","AIRLINE_ID"
"35","19065","Air Micronesia Inc.: AJ","AIRLINE_ID"
"36","19066","Sunbird Inc.: SKI","AIRLINE_ID"
"37","19067","Wings West Airlines: WWI","AIRLINE_ID"
"38","19068","Southcentral Air Inc.: AND","AIRLINE_ID"
"39","19069","Air Cargo Express Inc.: ACG","AIRLINE_ID"
"40","19070","Associated Aviation Act.: AAA","AIRLINE_ID"
"41","19071","Antilles Air Boats Inc.: AAB","AIRLINE_ID"
"42","19072","AAA Airlines: AAE","AIRLINE_ID"
"43","19073","Argosy Air Lines Inc.: AAL","AIRLINE_ID"
"44","19074","Air Bahia: ABH","AIRLINE_ID"
"45","19075","Airbama Incorporated: ABI","AIRLINE_ID"
"46","19076","Aeronaves Boringuena Inc.: ABO","AIRLINE_ID"
"47","19077","Alaska Central Airways Inc.: ACA","AIRLINE_ID"
"48","19078","Island Airlines Hawaii Inc.: ACH","AIRLINE_ID"
"49","19079","AAA-Action Air Carrier Inc.: ACI","AIRLINE_ID"
"50","19080","Air Cargo Enterprises Inc.: ACO","AIRLINE_ID"
"51","19081","Air Chaparral Inc.: ACP","AIRLINE_ID"
"52","19082","Alamo Commuter Airlines: ACS","AIRLINE_ID"
"53","19083","Air Central Inc. (1): ACT","AIRLINE_ID"
"54","19084","Air Central Inc.: ACK","AIRLINE_ID"
"55","19085","Astec Air East Inc.: AEC","AIRLINE_ID"
"56","19086","American Flag Airlines Inc.: AFA","AIRLINE_ID"
"57","19087","Air Cargo America Inc.: AGA","AIRLINE_ID"
"58","19088","All Island Air: AIA","AIRLINE_ID"
"59","19089","Air Express Inc.: AIE","AIRLINE_ID"
"60","19090","Air Mont. Inc.: AIM","AIRLINE_ID"
"61","19091","Air Indiana: AIN","AIRLINE_ID"
"62","19092","Air-Lift Associates Inc.: ALE","AIRLINE_ID"
"63","19093","Brandt Air: ALI","AIRLINE_ID"
"64","19094","All Seasons Air Pacific: ALL","AIRLINE_ID"
"65","19095","North American Airlines Inc.: AMA","AIRLINE_ID"
"66","19096","American Inter-Island Inc.: AMI","AIRLINE_ID"
"67","19097","Air Nebraska Inc.: ANB","AIRLINE_ID"
"68","19098","Airways Of New Mexico Inc.: ANM","AIRLINE_ID"
"69","19099","Metro Air Northeast Vermont: ANO","AIRLINE_ID"
"70","19100","Air North/Nenana: ANT","AIRLINE_ID"
"71","19101","Trans New York: AOI","AIRLINE_ID"
"72","19102","Arizona Pacific Inc.: API","AIRLINE_ID"
"73","19103","Appalachian Flying Service: APL","AIRLINE_ID"
"74","19104","Air Polynesia Inc.: APY","AIRLINE_ID"
"75","19105","Arizona Aero Corp.: ARI","AIRLINE_ID"
"76","19106","Arnold Aviation: ARN","AIRLINE_ID"
"77","19107","Air Oregon: ARO","AIRLINE_ID"
"78","19108","Arrowhead Airways Inc.: ARR","AIRLINE_ID"
"79","19109","Amistad Airlines: ASD","AIRLINE_ID"
"80","19110","Alpine Air Services Inc.: ASI","AIRLINE_ID"
"81","19111","Asap Air Inc.: ASP","AIRLINE_ID"
"82","19112","Astro Airways: AST","AIRLINE_ID"
"83","19113","Air Atlantic Airlines Inc.: ATN","AIRLINE_ID"
"84","19114","Pacific National Airways: ATO","AIRLINE_ID"
"85","19115","Atlantis Airlines Inc.: ATS","AIRLINE_ID"
"86","19116","Aerotransit Inc.: ATT","AIRLINE_ID"
"87","19117","Air Carolina: ATX","AIRLINE_ID"
"88","19118","Air Vectors Airways: AVA","AIRLINE_ID"
"89","19119","Aero Virgin Islands Corp.: AVI","AIRLINE_ID"
"90","19120","Aviation Services: AVS","AIRLINE_ID"
"91","19121","Southern Jersey Airways: AVZ","AIRLINE_ID"
"92","19122","Business Aircraft Corp.: BAC","AIRLINE_ID"
"93","19123","Brennan & Hargreaves Inc.: BAH","AIRLINE_ID"
"94","19124","Bankair Inc.: BAK","AIRLINE_ID"
"95","19125","Bard-Air Corp.: BAR","AIRLINE_ID"
"96","19126","Baja Cortez Airlines: BCA","AIRLINE_ID"
"97","19127","Bennington Aviation Inc.: BEN","AIRLINE_ID"
"98","19128","Beyer Aviation: BEY","AIRLINE_ID"
"99","19129","Blackhawk Airways Inc.: BHK","AIRLINE_ID"
"100","19130","Bighorn Airways Inc.: BHO","AIRLINE_ID"
"101","19131","Birchwood Air Service: BIR","AIRLINE_ID"
"102","19132","Bremerton Aviation Inc.: BMT","AIRLINE_ID"
"103","19133","Boise Air Service: BOA","AIRLINE_ID"
"104","19134","Brower Airways Inc.: BRO","AIRLINE_ID"
"105","19135","Burlington Airways Inc.: BUR","AIRLINE_ID"
"106","19136","Coleman Air Transport: CAC","AIRLINE_ID"
"107","19137","Crawford Aviation Inc.: CAI","AIRLINE_ID"
"108","19138","C & M Airlines: CAM","AIRLINE_ID"
"109","19139","Metro Air Northeast N Y: CAP","AIRLINE_ID"
"110","19140","Catalina Airlines Inc.: CAT","AIRLINE_ID"
"111","19141","Air Virginia: CAV","AIRLINE_ID"
"112","19142","Carriba Air Inc.: CBA","AIRLINE_ID"
"113","19143","Cen-Tex Airlines Inc.: CEN","AIRLINE_ID"
"114","19144","Century Airlines (Cal): CET","AIRLINE_ID"
"115","19145","Chandler Flyer: CHD","AIRLINE_ID"
"116","19146","Charter Airlines: CHE","AIRLINE_ID"
"117","19147","Hammonds Commuter Air Serv.: CHF","AIRLINE_ID"
"118","19148","Choi Aviation Inc.: CHO","AIRLINE_ID"
"119","19149","Christman Air System: CHS","AIRLINE_ID"
"120","19150","Cal Sierra Airlines: CIS","AIRLINE_ID"
"121","19151","Centennial Airlines: CNN","AIRLINE_ID"
"122","19152","Cotton Belt Aviation Inc.: COB","AIRLINE_ID"
"123","19153","Coker Aviation Inc.: COK","AIRLINE_ID"
"124","19154","Commutair: COM","AIRLINE_ID"
"125","19155","Coral Air Inc.: COR","AIRLINE_ID"
"126","19156","Cosmopolitan Comm. Airline: COS","AIRLINE_ID"
"127","19157","Southeastern Commuter: COT","AIRLINE_ID"
"128","19158","Courtesy Air Service Inc.: COU","AIRLINE_ID"
"129","19159","Capitol Air Lines: CPA","AIRLINE_ID"
"130","19160","Coastal Plains Commuter Inc.: CPC","AIRLINE_ID"
"131","19161","Commuter Airlines: CRA","AIRLINE_ID"
"132","19162","Crown Aviaiton Inc.: CRN","AIRLINE_ID"
"133","19163","Crown Airways Inc.: CRO","AIRLINE_ID"
"134","19164","Crested Butte Air Service: CRT","AIRLINE_ID"
"135","19165","Catskill Airways Inc.: CSK","AIRLINE_ID"
"136","19166","Century Airlines: CTA","AIRLINE_ID"
"137","19167","Cothron Aviation: CTH","AIRLINE_ID"
"138","19168","Catalina-Vegas Airlines: CVA","AIRLINE_ID"
"139","19169","Danbury Airlines: DAN","AIRLINE_ID"
"140","19170","Downeast Airlines Inc.: DEA","AIRLINE_ID"
"141","19171","Decatur Aviation: DEC","AIRLINE_ID"
"142","19172","DHL Airlines Inc.: DHL","AIRLINE_ID"
"143","19173","Dickman Aviation Services: DIC","AIRLINE_ID"
"144","19174","Desert Pacific Airways: DPA","AIRLINE_ID"
"145","19175","Desert Pacific Airlines Inc.: DPI","AIRLINE_ID"
"146","19176","Desert Airlines: DST","AIRLINE_ID"
"147","19177","Executive Aviation Inc.: EAI","AIRLINE_ID"
"148","19178","Eastern Caribbean Airways: EAS","AIRLINE_ID"
"149","19179","Eastern Carolina Aviation: ECI","AIRLINE_ID"
"150","19180","Ede Aire: EDE","AIRLINE_ID"
"151","19181","Executive Four Winds: EFA","AIRLINE_ID"
"152","19182","Eagle Commuter Airlines Inc.: EGL","AIRLINE_ID"
"153","19183","East Hampton Aire Inc.: EHA","AIRLINE_ID"
"154","19184","East. Indiana Aviation Sale: EIA","AIRLINE_ID"
"155","19185","Air Pacific Inc.: EKA","AIRLINE_ID"
"156","19186","Erie Airways Inc.: ERI","AIRLINE_ID"
"157","19187","Empire Aero Service: ERO","AIRLINE_ID"
"158","19188","Evanston Aviation: EVA","AIRLINE_ID"
"159","19189","Federal Armored Service Inc.: FAR","AIRLINE_ID"
"160","19190","Young Flying Service: FBI","AIRLINE_ID"
"161","19191","Southern Airlines Inc.: FCA","AIRLINE_ID"
"162","19192","Florida Airlines Inc.: FDA","AIRLINE_ID"
"163","19193","Freedom Airlines Inc.: FDM","AIRLINE_ID"
"164","19194","Flamenco Airways Inc.: FLM","AIRLINE_ID"
"165","19195","Ford-Aire Inc.: FOR","AIRLINE_ID"
"166","19196","Foster Aviation: FOS","AIRLINE_ID"
"167","19197","Skycraft Inc.: FVA","AIRLINE_ID"
"168","19198","Far West Airlines: FWA","AIRLINE_ID"
"169","19199","General Aviation Inc.: GAS","AIRLINE_ID"
"170","19200","Gromer Aviation Inc.: GAV","AIRLINE_ID"
"171","19201","Central States Airline: GBA","AIRLINE_ID"
"172","19202","Golden Carriage Aire: GCA","AIRLINE_ID"
"173","19203","Midway Commuter: GCS","AIRLINE_ID"
"174","19204","Green Hills Aviation Ltd.: GHA","AIRLINE_ID"
"175","19205","Green Mountain Airlines Ltd.: GMA","AIRLINE_ID"
"176","19206","Copper State Airlines: GOF","AIRLINE_ID"
"177","19207","Isle Royale Seaplane Serv.: GRO","AIRLINE_ID"
"178","19208","Golden South Airlines Inc.: GSL","AIRLINE_ID"
"179","19209","Gull Air Inc.: GUL","AIRLINE_ID"
"180","19210","Gunnel Aviation Inc.: GUN","AIRLINE_ID"
"181","19211","Ross Aviation Inc.: GWE","AIRLINE_ID"
"182","19212","Heussler Air Service Corp: HEU","AIRLINE_ID"
"183","19213","Hensley Flying Service Inc.: HFS","AIRLINE_ID"
"184","19214","Long Island Airlines: HMZ","AIRLINE_ID"
"185","19215","Holiday Airlines Inc.: HOL","AIRLINE_ID"
"186","19216","Iowa Airlines: HOR","AIRLINE_ID"
"187","19217","Pacific Coast Airlines: HPZ","AIRLINE_ID"
"188","19218","Trans-National Airlines Haw: HRA","AIRLINE_ID"
"189","19219","Scenic Airlines Inc.: HSZ","AIRLINE_ID"
"190","19220","Skystream Airlines: HUB","AIRLINE_ID"
"191","19221","Hawking Corporation: HWK","AIRLINE_ID"
"192","19222","Hyannis Aviation: HYA","AIRLINE_ID"
"193","19223","Iowa City Flying Service: ICF","AIRLINE_ID"
"194","19224","Idee Industries Inc.: III","AIRLINE_ID"
"195","19225","Inland Empire Airlines Inc.: INA","AIRLINE_ID"
"196","19226","Indiana Airways Inc. (Pa): IND","AIRLINE_ID"
"197","19227","Indo-Pacific International: IPI","AIRLINE_ID"
"198","19228","Island Airlines: ISL","AIRLINE_ID"
"199","19229","Sunbelt Airlines Inc.: JAM","AIRLINE_ID"
"200","19230","Air Chico: JCM","AIRLINE_ID"
"201","19231","Jer-Don Air: JER","AIRLINE_ID"
"202","19232","Knight Airlines Inc.: KAI","AIRLINE_ID"
"203","19233","Key Airlines: KEE","AIRLINE_ID"
"204","19234","Crown Air: KWZ","AIRLINE_ID"
"205","19235","Chaparral Airlines Inc.: KXZ","AIRLINE_ID"
"206","19236","Lancer Aviation Inc.: LAN","AIRLINE_ID"
"207","19237","Lawrence Aviation: LAW","AIRLINE_ID"
"208","19238","Havasu Airlines: LHA","AIRLINE_ID"
"209","19239","Lakeland Aviation: LLA","AIRLINE_ID"
"210","19240","Aero Commuter: LOS","AIRLINE_ID"
"211","19241","Las Vegas Airlines: LVA","AIRLINE_ID"
"212","19242","Magum Airlines: MAG","AIRLINE_ID"
"213","19243","The Maui Commuter: MAI","AIRLINE_ID"
"214","19244","Marshall's Air Inc.: MAR","AIRLINE_ID"
"215","19245","Maxair Inc.: MAX","AIRLINE_ID"
"216","19246","Mid Continental Airlines In: MCO","AIRLINE_ID"
"217","19247","Metro Airlines: MDU","AIRLINE_ID"
"218","19248","Metroplex Airlines: MET","AIRLINE_ID"
"219","19249","Midway Aviation Inc.: MIY","AIRLINE_ID"
"220","19250","Miller Air Transportersinc: MLL","AIRLINE_ID"
"221","19251","Ocean Airways Inc.: MMH","AIRLINE_ID"
"222","19252","Cumberland Airlines: MNZ","AIRLINE_ID"
"223","19253","Merrimack Aviation Inc.: MRR","AIRLINE_ID"
"224","19254","Midwest Aviation: MST","AIRLINE_ID"
"225","19255","Arkansas Traveler Airline: MTA","AIRLINE_ID"
"226","19256","Metroflight Airlines: MTR","AIRLINE_ID"
"227","19257","National Air Commuter Inc.: NAC","AIRLINE_ID"
"228","19258","New Born Wings Inc.: NEB","AIRLINE_ID"
"229","19259","Nor East Commuter Airlines: NEC","AIRLINE_ID"
"230","19260","Nevada Airlines: NEV","AIRLINE_ID"
"231","19261","Northern Eagle Airways Inc.: NGL","AIRLINE_ID"
"232","19262","Newair Flight Inc.: NHA","AIRLINE_ID"
"233","19263","N. J. Merrimack Airlines: NJA","AIRLINE_ID"
"234","19264","E. J. A. Newport Inc.: NPT","AIRLINE_ID"
"235","19265","Northaire: NTH","AIRLINE_ID"
"236","19266","Lake State Airways: NUM","AIRLINE_ID"
"237","19267","New York Helicopter Corp.: NYH","AIRLINE_ID"
"238","19268","Harbor Airlines Inc.: OAK","AIRLINE_ID"
"239","19269","Ocean Reef Airways Inc.: OCR","AIRLINE_ID"
"240","19270","Offshore Logistics: OFF","AIRLINE_ID"
"241","19271","Omaha Aviation: OHA","AIRLINE_ID"
"242","19272","Corporate Air Inc.: OIZ","AIRLINE_ID"
"243","19273","Omak Aviation Airlines: OMK","AIRLINE_ID"
"244","19274","Omni Pacific Airline: OMN","AIRLINE_ID"
"245","19275","Sun Aire Lines: OOZ","AIRLINE_ID"
"246","19276","Air Kentucky Air Lines: OWS","AIRLINE_ID"
"247","19277","Permian Airways Inc.: PAI","AIRLINE_ID"
"248","19278","Provincetown Boston: PBA","AIRLINE_ID"
"249","19279","Piasa Commuter Airlines: PCA","AIRLINE_ID"
"250","19280","Trans Southern Airways: PDA","AIRLINE_ID"
"251","19281","Pearson Aircraft: PEA","AIRLINE_ID"
"252","19282","Air Pennsylvania: PER","AIRLINE_ID"
"253","19283","Petro Aviation Corp.: PET","AIRLINE_ID"
"254","19284","Phillips Airlines: PHL","AIRLINE_ID"
"255","19285","Phoenix Airlines: PHX","AIRLINE_ID"
"256","19286","Pacific Island Airways: PIA","AIRLINE_ID"
"257","19287","Planes Inc.: PLA","AIRLINE_ID"
"258","19288","Polar Airways Inc.: PLZ","AIRLINE_ID"
"259","19289","Pacific Missionary Aviation: PMA","AIRLINE_ID"
"260","19290","Pioneer Airways: PNR","AIRLINE_ID"
"261","19291","Pocono Airlines Inc.: POC","AIRLINE_ID"
"262","19292","Pompano Airways: POM","AIRLINE_ID"
"263","19293","Ponderosa Aviation Inc.: PON","AIRLINE_ID"
"264","19294","Princeton Aviation Corp: PRA","AIRLINE_ID"
"265","19295","Pro Air Services: PRR","AIRLINE_ID"
"266","19296","Precision Valley Aviation: PVA","AIRLINE_ID"
"267","19297","Bar Harbor Airways: QOZ","AIRLINE_ID"
"268","19298","Royal-Air Ltd.: RAL","AIRLINE_ID"
"269","19299","Realwest Airlines: REA","AIRLINE_ID"
"270","19300","Aerosun Int'l Airlines Inc.: RED","AIRLINE_ID"
"271","19301","Royal Hawaiian Airways Inc.: RHA","AIRLINE_ID"
"272","19302","Richardson Aviation: RIC","AIRLINE_ID"
"273","19303","Indiana Airways Inc. (Reid: RID","AIRLINE_ID"
"274","19304","Rio Airways Inc.: RIO","AIRLINE_ID"
"275","19305","Riverside Air Service: RIV","AIRLINE_ID"
"276","19306","Michigan Airways Inc.: RJS","AIRLINE_ID"
"277","19307","Roederer Aviation Inc.: ROE","AIRLINE_ID"
"278","19308","Royal American Airways Inc.: ROY","AIRLINE_ID"
"279","19309","Air Rovers Inc.: RWG","AIRLINE_ID"
"280","19310","Sajen Air Inc.: SAJ","AIRLINE_ID"
"281","19311","Samoan Airlines Inc.: SAM","AIRLINE_ID"
"282","19312","Air Cortez International: SAS","AIRLINE_ID"
"283","19313","Air Americana: SAX","AIRLINE_ID"
"284","19314","Saber Aviation Inc.: SBA","AIRLINE_ID"
"285","19315","Suburban Airlines: SBN","AIRLINE_ID"
"286","19316","Seaco Airlines Inc.: SCO","AIRLINE_ID"
"287","19317","Skyline Airlines: SCT","AIRLINE_ID"
"288","19318","South Coast Airways: SCY","AIRLINE_ID"
"289","19319","Semo Aviation Inc.: SEM","AIRLINE_ID"
"290","19320","Stahmannfarms Inc.: SFI","AIRLINE_ID"
"291","19321","Sfo Helicopter Airlines Inc.: SFO","AIRLINE_ID"
"292","19322","Sierra Flite Service Inc.: SFS","AIRLINE_ID"
"293","19323","Shasta Air Inc.: SHS","AIRLINE_ID"
"294","19324","Shavano Air Inc.: SHV","AIRLINE_ID"
"295","19325","Silver State Airlines: SIA","AIRLINE_ID"
"296","19326","San Juan Airlines Inc.: SJA","AIRLINE_ID"
"297","19327","Bas Airlines: SKL","AIRLINE_ID"
"298","19328","Scheduled Skyways: SKM","AIRLINE_ID"
"299","19329","Stopher Mechanical Inc.: SMC","AIRLINE_ID"
"300","19330","Gelco Courier Services Inc.: SNC","AIRLINE_ID"
"301","19331","Shawnee Airlines: SNE","AIRLINE_ID"
"302","19332","Mall Airways Inc.: SOA","AIRLINE_ID"
"303","19333","Soonair Lines Inc.: SOL","AIRLINE_ID"
"304","19334","Springfield Air Service: SPF","AIRLINE_ID"
"305","19335","Sterling Air Service: SRL","AIRLINE_ID"
"306","19336","Southern Seaplane: SSP","AIRLINE_ID"
"307","19337","Sierra Express Inc.: SSS","AIRLINE_ID"
"308","19338","Seaplane Shuttle Transport: SST","AIRLINE_ID"
"309","19339","Trans East International: STF","AIRLINE_ID"
"310","19340","Star Aviation Corporation: STR","AIRLINE_ID"
"311","19341","Sun International Airways: SUI","AIRLINE_ID"
"312","19342","Sunbelt: SUT","AIRLINE_ID"
"313","19343","Sun Valley Airlines: SVL","AIRLINE_ID"
"314","19344","Sunwest Airlines: SWA","AIRLINE_ID"
"315","19345","Air Colorado: TAC","AIRLINE_ID"
"316","19346","Tejas Airlines Inc.: TAL","AIRLINE_ID"
"317","19347","Yosemite Airlines Inc.: TAS","AIRLINE_ID"
"318","19348","Trans Catalina Airlines: TCA","AIRLINE_ID"
"319","19349","Oceanair Line: TCE","AIRLINE_ID"
"320","19350","Trans California Airlines: TCI","AIRLINE_ID"
"321","19351","Trans-Central Airlines Inc.: TCL","AIRLINE_ID"
"322","19352","Trans-Colorado Airlines: TCO","AIRLINE_ID"
"323","19353","Tennessee Airways Inc.: TEN","AIRLINE_ID"
"324","19354","Terre Haute Air Commuter: TER","AIRLINE_ID"
"325","19355","Thorson Aviation: THO","AIRLINE_ID"
"326","19356","Trans Air Inc.: TIA","AIRLINE_ID"
"327","19357","Skyfreight: TIS","AIRLINE_ID"
"328","19358","Trans Mo Airlines: TMA","AIRLINE_ID"
"329","19359","Transtate Aviation: TNS","AIRLINE_ID"
"330","19360","Trans Pennsylvania Airlines: TRP","AIRLINE_ID"
"331","19361","Trans Sierra Airlines Inc.: TSI","AIRLINE_ID"
"332","19362","Tulsair Beechcraft Inc.: TUL","AIRLINE_ID"
"333","19363","Temsco Airlines: TYE","AIRLINE_ID"
"334","19364","Universal Airways Inc.: UAI","AIRLINE_ID"
"335","19365","Air U.S.: USA","AIRLINE_ID"
"336","19366","Vagabond Aviation Inc.: VAG","AIRLINE_ID"
"337","19367","Britt Airlines Inc.: VER","AIRLINE_ID"
"338","19368","Viking Express: VIG","AIRLINE_ID"
"339","19369","Vale International Airlines: VIN","AIRLINE_ID"
"340","19370","Valley Airlines: VLY","AIRLINE_ID"
"341","19371","Air East Airlines: WAC","AIRLINE_ID"
"342","19372","Walker's International: WCA","AIRLINE_ID"
"343","19373","Mountainwest Airlines: WCI","AIRLINE_ID"
"344","19374","Western Star Airlines Inc.: WES","AIRLINE_ID"
"345","19375","Western Charter Inc.: WET","AIRLINE_ID"
"346","19376","Wheeler Airlines: WFS","AIRLINE_ID"
"347","19377","Wisc Air: WIA","AIRLINE_ID"
"348","19378","Will's Air: WIL","AIRLINE_ID"
"349","19379","Wings Airways: WNG","AIRLINE_ID"
"350","19380","Mcphillips Flying Service: ZFZ","AIRLINE_ID"
"351","19381","Air New Mexico: ZIA","AIRLINE_ID"
"352","19382","Winnipesaukee Aviation Inc.: ZMZ","AIRLINE_ID"
"353","19383","Skyway Aviation Inc.: ZYZ","AIRLINE_ID"
"354","19384","P.S. Air Freight Inc.: PSA","AIRLINE_ID"
"355","19385","Reeve Aleutian Airways Inc.: RV","AIRLINE_ID"
"356","19386","Northwest Airlines Inc.: NW","AIRLINE_ID"
"357","19387","Wien Air Alaska Inc.: WC","AIRLINE_ID"
"358","19388","Southern Airways: FTI","AIRLINE_ID"
"359","19389","Air Florida Inc.: QH","AIRLINE_ID"
"360","19390","Air California Inc.: OC","AIRLINE_ID"
"361","19391","Pacific Southwest Airlines: PS","AIRLINE_ID"
"362","19392","Rich International Airways: RIQ","AIRLINE_ID"
"363","19393","Southwest Airlines Co.: WN","AIRLINE_ID"
"364","19394","Mid-South Aviation Inc.: VL","AIRLINE_ID"
"365","19395","Mid-South Aviation Inc. (1): RCA","AIRLINE_ID"
"366","19396","Sky West Aviation Inc.: QG","AIRLINE_ID"
"367","19397","Republic Airlines Inc.: RC","AIRLINE_ID"
"368","19398","Dauphin Island Airways: DAU","AIRLINE_ID"
"369","19399","New York Air Inc.: NY","AIRLINE_ID"
"370","19400","Global Int'l Airways Corp.: GIQ","AIRLINE_ID"
"371","19401","Colgan Airways Inc.: CJ","AIRLINE_ID"
"372","19402","Overseas National Airways: UNQ","AIRLINE_ID"
"373","19403","Flight International: PTQ","AIRLINE_ID"
"374","19404","Academy Airlines: ACD","AIRLINE_ID"
"375","19405","Check-Air Inc.: ACL","AIRLINE_ID"
"376","19406","Transwest Air Express: ACW","AIRLINE_ID"
"377","19407","Airgo Inc.: AIG","AIRLINE_ID"
"378","19408","American Air Transport: AMT","AIRLINE_ID"
"379","19409","Bo-S-Aire Airlines Inc.: BOI","AIRLINE_ID"
"380","19410","Combs Airways Inc.: CMB","AIRLINE_ID"
"381","19411","Summit Airlines Inc.: DUZ","AIRLINE_ID"
"382","19412","Eagle Aviation Inc.: EEZ","AIRLINE_ID"
"383","19413","Falwell Aviation Inc.: FAA","AIRLINE_ID"
"384","19414","Falcon Airways Inc.: FAC","AIRLINE_ID"
"385","19415","Pinehurst Airlines Inc.: PHR","AIRLINE_ID"
"386","19416","Great Western Airlines Inc.: ROS","AIRLINE_ID"
"387","19417","Air Freight Express: RRT","AIRLINE_ID"
"388","19418","S. S. Airways Inc.: SSA","AIRLINE_ID"
"389","19419","Aero Union Corp: XAA","AIRLINE_ID"
"390","19420","Air Express Int'l Airlines: XAC","AIRLINE_ID"
"391","19421","Central American Int'l: XAJ","AIRLINE_ID"
"392","19422","Michigan Peninsula Airways: XAT","AIRLINE_ID"
"393","19423","WTC Airlines: XBF","AIRLINE_ID"
"394","19424","Profit Airlines Inc.: XBH","AIRLINE_ID"
"395","19425","CF Air Freight: XBI","AIRLINE_ID"
"396","19426","International Air Service: XBJ","AIRLINE_ID"
"397","19427","Aeronaves De Puerto Rico: XBQ","AIRLINE_ID"
"398","19428","Allstates Air Cargo Inc.: XBR","AIRLINE_ID"
"399","19429","Cam Air International Inc.: XAQ","AIRLINE_ID"
"400","19430","Purolator Sky Courier Inc.: XAZ","AIRLINE_ID"
"401","19431","Circle Airfreight Corp.: XBP","AIRLINE_ID"
"402","19432","Pacific Alaska Airlines Inc.: XBT","AIRLINE_ID"
"403","19433","Icb International Airlines: XBX","AIRLINE_ID"
"404","19434","Cohlmia Aviation: XAM","AIRLINE_ID"
"405","19435","Amerford Airways Inc.: XAE","AIRLINE_ID"
"406","19436","Astro-Wing Airlines Inc.: XAF","AIRLINE_ID"
"407","19437","Ball Brothers Inc.: XAG","AIRLINE_ID"
"408","19438","Burlington Northern Inc.: XAI","AIRLINE_ID"
"409","19439","Century Airlines Inc.: XAK","AIRLINE_ID"
"410","19440","Dallas Flight Center: XAO","AIRLINE_ID"
"411","19441","Jet Way Inc.: XAR","AIRLINE_ID"
"412","19442","Klondike Air Inc.: XAS","AIRLINE_ID"
"413","19443","Pat Air: XAY","AIRLINE_ID"
"414","19444","Phh Air Inc.: XBM","AIRLINE_ID"
"415","19445","Flight Line Inc.: XAU","AIRLINE_ID"
"416","19446","Viking Int'l Airlines Inc.: CGL","AIRLINE_ID"
"417","19447","Capitol International Inc.: CL","AIRLINE_ID"
"418","19448","Air Caravane Inc.: AEQ","AIRLINE_ID"
"419","19449","Argo S. A.: AGQ","AIRLINE_ID"
"420","19450","Norontair: AIQ","AIRLINE_ID"
"421","19451","Alberta Northern Airlines: ALQ","AIRLINE_ID"
"422","19452","Aviacion Y Comercio S.A.: AO","AIRLINE_ID"
"423","19453","Air Bvi Limited: BLQ","AIRLINE_ID"
"424","19454","Spantax S. A.: BXQ","AIRLINE_ID"
"425","19455","Dan Air Services: DA","AIRLINE_ID"
"426","19456","Maersk Air I/S: DM","AIRLINE_ID"
"427","19457","Aerolineas Dominicanas S A: DOQ","AIRLINE_ID"
"428","19458","Caribwest Airways Ltd.: DQQ","AIRLINE_ID"
"429","19459","Execaire Aviation Ltd.: EBQ","AIRLINE_ID"
"430","19460","Aero Trades (Western) Ltd.: ERQ","AIRLINE_ID"
"431","19461","Fast Air Carrier Ltd. (1): FAQ","AIRLINE_ID"
"432","19462","Business Flights Ltd.: HIQ","AIRLINE_ID"
"433","19463","Tar Airlines: HRQ","AIRLINE_ID"
"434","19464","Transavia Holland B. V.: HVQ","AIRLINE_ID"
"435","19465","Iscargo Hf: ICQ","AIRLINE_ID"
"436","19466","Tradewinds Airways Ltd.: IKQ","AIRLINE_ID"
"437","19467","Aerlinte Eireann Teoranta: IN","AIRLINE_ID"
"438","19468","Iran National Airlines Corp: IR","AIRLINE_ID"
"439","19469","Inair: IXQ","AIRLINE_ID"
"440","19470","Allarco Developments Ltd.: JXQ","AIRLINE_ID"
"441","19471","Transmeridian Air Cargo Ltd.: KKQ","AIRLINE_ID"
"442","19472","Kelowna Flightcraft Air Cha: KWQ","AIRLINE_ID"
"443","19473","Liat (1974) Limited: LIQ","AIRLINE_ID"
"444","19474","Millardair Limited: MAQ","AIRLINE_ID"
"445","19475","Montana Austria Flugetrieb: MGQ","AIRLINE_ID"
"446","19476","P.N. Merpati Nusantara Air.: MZ","AIRLINE_ID"
"447","19477","North Cariboo Flying Serv.: NFQ","AIRLINE_ID"
"448","19478","Norcanair: NKQ","AIRLINE_ID"
"449","19479","Northward Airlines Ltd.: NN","AIRLINE_ID"
"450","19480","North Coast Air Services: NSQ","AIRLINE_ID"
"451","19481","National Aviation Consult.: NTQ","AIRLINE_ID"
"452","19482","Air Niugini: NUQ","AIRLINE_ID"
"453","19483","Nunasi-Central Airlines Ltd.: ONQ","AIRLINE_ID"
"454","19484","Ontario Worldair Limited: OWQ","AIRLINE_ID"
"455","19485","Pem-Air Limited: PD (1)","AIRLINE_ID"
"456","19486","Eastern Provincial Airways: PV","AIRLINE_ID"
"457","19487","Pacific Western Airlines: PW","AIRLINE_ID"
"458","19488","Inter-Quebec (Intair): QB","AIRLINE_ID"
"459","19489","Syrian Arab Airlines: RB","AIRLINE_ID"
"460","19490","Aerotransportes Entre Rios: RSQ","AIRLINE_ID"
"461","19491","Redcoat Air Cargo Limited: RY","AIRLINE_ID"
"462","19492","Skycharter (Malton) Ltd.: SJQ","AIRLINE_ID"
"463","19493","Superior Airways Limited: SSQ","AIRLINE_ID"
"464","19494","Belize Airways Limited: ST","AIRLINE_ID"
"465","19495","Skycraft Air Transport Inc.: STQ","AIRLINE_ID"
"466","19496","Trans-Mediterranean Airways: TLQ","AIRLINE_ID"
"467","19497","British Caribbean Airways: TXQ","AIRLINE_ID"
"468","19498","Air Manila Inc.: UMQ","AIRLINE_ID"
"469","19499","Avalon Aviation Ltd.: VOQ","AIRLINE_ID"
"470","19500","Wardair Canada Inc.: WDQ","AIRLINE_ID"
"471","19501","Gateway Aviation Limited: WGQ","AIRLINE_ID"
"472","19502","Windward Islands Airways: WM","AIRLINE_ID"
"473","19503","Nal Inc.: XBV","AIRLINE_ID"
"474","19504","Yellow Bird Air: YBQ","AIRLINE_ID"
"475","19505","Air Europe Limited: AE","AIRLINE_ID"
