"7243","RBM","Straubing, De,","AIRPORTS"
"7244","RBN","Fort Jefferson, Fl,","AIRPORTS"
"7245","RBO","Robore, Bolivia: Robore Airport","AIRPORTS"
"7246","RBP","Raba Raba, Pg,","AIRPORTS"
"7247","RBQ","Rurrenabaque, Bo,","AIRPORTS"
"7248","RBR","Rio Branco, Brazil: Rio Branco","AIRPORTS"
"7249","RBU","Roebourne, Australia: Roebourne Airport","AIRPORTS"
"7250","RBV","Rancho Buena Vista, Mx,","AIRPORTS"
"7251","RBY","Ruby, AK: Ruby Airport","AIRPORTS"
"7252","RCA","Rapid City, SD: Ellsworth Air Force Base","AIRPORTS"
"7253","RCB","Richards Bay, Republic Of South Africa: Richards Bay Airport","AIRPORTS"
"7254","RCE","Roche Harbor, WA: Roche Harbor Airport","AIRPORTS"
"7255","RCH","Riohacha, Colombia: Riohacha Airport","AIRPORTS"
"7256","RCL","Redcliffe, Vu,","AIRPORTS"
"7257","RCM","Richmond, Australia: Richmond Airport","AIRPORTS"
"7258","RCN","American River, Au,","AIRPORTS"
"7259","RCO","Rochefort, France: Saint Agnant","AIRPORTS"
"7260","RCQ","Reconquista, Argentina: Reconquista Airport","AIRPORTS"
"7261","RCT","Reed City, MI: Miller Field","AIRPORTS"
"7262","RCU","Rio Curato, Argentina: Rio Cuarto","AIRPORTS"
"7263","RDA","Rockhampton Downs, Australia: Rockhampton Downs Airport","AIRPORTS"
"7264","RDB","Red Dog, AK: Red Dog Mine","AIRPORTS"
"7265","RDC","Redencao, Brazil: Redencao Airport","AIRPORTS"
"7266","RDD","Redding, CA: Redding Municipal","AIRPORTS"
"7267","RDE","Merdey, Id,","AIRPORTS"
"7268","RDG","Reading, PA: Reading Municipal Gen C A Spaatz","AIRPORTS"
"7269","RDM","Bend/Redmond, OR: Roberts Field","AIRPORTS"
"7270","RDR","Red River, ND: Grand Forks Air Force Base","AIRPORTS"
"7271","RDS","Rincon De Los Sauces, Ar,","AIRPORTS"
"7272","RDT","Richard-Toll, Senegal: Richard-Toll","AIRPORTS"
"7273","RDU","Raleigh/Durham, NC: Raleigh Durham","AIRPORTS"
"7274","RDV","Red Devil, AK: Red Devil Airport","AIRPORTS"
"7275","RDZ","Rodez, France: Rodez Airport","AIRPORTS"
"7276","REB","Redlands, CA: Redlands Municipal","AIRPORTS"
"7277","REC","Recife, Brazil: Guararapes","AIRPORTS"
"7278","RED","Reedsville, PA: Mifflin County","AIRPORTS"
"7279","REE","Lubbock, TX: Reese Air Force Base","AIRPORTS"
"7280","REG","Reggio Calabria, Italy: Reggio Calabria Airport","AIRPORTS"
"7281","REH","Rehoboth, DE: Rehoboth Aircrafters","AIRPORTS"
"7282","REK","Reykjavik, Iceland: Metropolitan Area","AIRPORTS"
"7283","REL","Trelew, Argentina: Trelew Civil","AIRPORTS"
"7284","REM","Route 128, MA: Route 128 Airport","AIRPORTS"
"7285","REN","Orenburg, Russia (European): Orenburg Airport","AIRPORTS"
"7286","REP","Siem Reap, Democratic Kampuchea (Cambodia): Siem Reap Airport","AIRPORTS"
"7287","RER","Retalhuleu, Guatemala: Base Aerea Del Sur","AIRPORTS"
"7288","RES","Resistencia, Argentina: Resistencia Airport","AIRPORTS"
"7289","RET","Rost, Norway: Rost Airport","AIRPORTS"
"7290","REU","Reus, Spain: Reus Airport","AIRPORTS"
"7291","REX","Reynosa, Mexico: Reynosa International","AIRPORTS"
"7292","REY","Reyes, Bolivia: Reyes Airport","AIRPORTS"
"7293","REZ","Resende, Br,","AIRPORTS"
"7294","RFD","Rockford, IL: Chicago / Rockford International","AIRPORTS"
"7295","RFN","Raufarhofn, Is,","AIRPORTS"
"7296","RFP","Raiatea, French Polynesia: Uturoa","AIRPORTS"
"7297","RFS","Rosita, Ni,","AIRPORTS"
"7298","RGA","Rio Grande, Argentina: Rio Grande Airport","AIRPORTS"
"7299","RGE","Porgera, Pg,","AIRPORTS"
"7300","RGI","Rangiroa, French Polynesia: Rangiroa Airport","AIRPORTS"
"7301","RGL","Rio Gallegos, Argentina: Rio Gallegos Airport","AIRPORTS"
"7302","RGN","Yangon, Myanmar: Yangon International","AIRPORTS"
"7303","RGT","Rengat, Indonesia: Japura","AIRPORTS"
"7304","RHD","Rio Hondo, Ar,","AIRPORTS"
"7305","RHE","Reims, France: Reims/Champagne","AIRPORTS"
"7306","RHI","Rhinelander, WI: Rhinelander/Oneida County","AIRPORTS"
"7307","RHN","Unknown Code Description,","AIRPORTS"
"7308","RHO","Rhodes, Greece: Rodos","AIRPORTS"
"7309","RHP","Ramechap, Np,","AIRPORTS"
"7310","RIA","Santa Maria, Brazil: Santa Maria Airport","AIRPORTS"
"7311","RIB","Riberalta, Bolivia: Riberalta Airport","AIRPORTS"
"7312","RIC","Richmond, VA: Richmond International Aqirport","AIRPORTS"
"7313","RID","Richmond, IN: Richmond Municipal","AIRPORTS"
"7314","RIE","Rice Lake, WI: Rice Lake Airport","AIRPORTS"
"7315","RIF","Richfield, UT: Richfield Municipal","AIRPORTS"
"7316","RIG","Rio Grande, Brazil: Rio Grande Airport","AIRPORTS"
"7317","RIJ","Rioja, Peru: Rioja","AIRPORTS"
"7318","RIK","Carrillo, Cr,","AIRPORTS"
"7319","RIL","Rifle, CO: Garfield County","AIRPORTS"
"7320","RIM","Mendoza, Pe,","AIRPORTS"
"7321","RIN","Ringi Cove, Sb,","AIRPORTS"
"7322","RIO","Rio De Janeiro, Brazil: Metropolitan Area","AIRPORTS"
"7323","RIR","Riverside, CA: Riverside Flabob","AIRPORTS"
"7324","RIS","Rishiri, Jp,","AIRPORTS"
"7325","RIV","Riverside, CA: March Air Force Base","AIRPORTS"
"7326","RIW","Riverton/Lander, WY: Riverton Municipal","AIRPORTS"
"7327","RIX","Riga, Latvia: Riga Airport","AIRPORTS"
"7328","RIY","Riyan Mukalla, Yemen: Riyan","AIRPORTS"
"7329","RJH","Rajshahi, Bd,","AIRPORTS"
"7330","RJK","Rijeka, Croatia: Rijeka Airport","AIRPORTS"
"7331","RJL","Logrono, Spain: Logrono Airport","AIRPORTS"
"7332","RJN","Unknown Code Description,","AIRPORTS"
"7333","RKD","Rockland, ME: Knox County Regional","AIRPORTS"
"7334","RKE","Copenhagen, Denmark: Roskilde","AIRPORTS"
"7335","RKP","Rockport, TX: Aransas County","AIRPORTS"
"7336","RKR","Poteau, OK: Robert S Kerr","AIRPORTS"
"7337","RKS","Rock Springs, WY: Rock Springs Sweetwater County","AIRPORTS"
"7338","RKT","Ras Al Khaimah, United Arab Emirates: Ras Al Khaimah International","AIRPORTS"
"7339","RKU","Kairuku, Pg,","AIRPORTS"
"7340","RKV","Reykjavik, Iceland: Reykjavik","AIRPORTS"
"7341","RKW","Rockwood, TN: Rockwood Municipal","AIRPORTS"
"7342","RLA","Rolla, MO: Rolla National","AIRPORTS"
"7343","RLD","Richland, WA: Richland Airport","AIRPORTS"
"7344","RLG","Rostock-Laage, Germany: Rostock-Laage Airport","AIRPORTS"
"7345","RLO","Rio Cuarto, Argentina,","AIRPORTS"
"7346","RLT","Arlit, Niger: Arlit Airport","AIRPORTS"
"7347","RLU","Bornite/Ruby Creek, AK: Bornite Upper","AIRPORTS"
"7348","RMA","Roma, Australia: Roma Airport","AIRPORTS"
"7349","RMD","Ramagundam, India,","AIRPORTS"
"7350","RME","Rome, NY: Griffiss Air Force Base","AIRPORTS"
"7351","RMF","Hurghada, Egypt,","AIRPORTS"
"7352","RMG","Rome, GA: Richard B Russell","AIRPORTS"
"7353","RMI","Rimini, Italy: Rimini Airport","AIRPORTS"
"7354","RMK","Renmark, Au,","AIRPORTS"
"7355","RML","Ratmalana, Sri Lanka: Colombo/Ratmalana","AIRPORTS"
"7356","RMO","Ormoc: Ormoc","AIRPORTS"
"7357","RMP","Rampart, AK: Rampart Airport","AIRPORTS"
"7358","RMQ","Taichung, Taiwan: Ching Chuan Kang","AIRPORTS"
"7359","RMS","Ramstein, Germany: Ramstein Ab","AIRPORTS"
"7360","RMT","Rocky Mount/wilson, Nc,","AIRPORTS"
"7361","RNA","Unknown Code Description,","AIRPORTS"
"7362","RNB","Ronneby, Sweden: Ronneby Airport","AIRPORTS"
"7363","RNC","Mcminnville, TN: Warren County Memorial","AIRPORTS"
"7364","RND","San Antonio, TX: Randolph Air Force Base","AIRPORTS"
"7365","RNE","Roanne, France: Renaison","AIRPORTS"
"7366","RNG","Rangely, CO: Rangely Airport","AIRPORTS"
"7367","RNI","Corn Island, Nicaragua: Corn Island Airport","AIRPORTS"
"7368","RNJ","Unknown Code Description,","AIRPORTS"
"7369","RNL","Rennell, Sb,","AIRPORTS"
"7370","RNN","Ronne, Denmark: Ronne Airport","AIRPORTS"
"7371","RNO","Reno, NV: Reno International","AIRPORTS"
"7372","RNP","Rongelap Island, Mh,","AIRPORTS"
"7373","RNS","Rennes, France: Rennes/St Jacques","AIRPORTS"
"7374","RNT","Renton, WA: Renton Municipal","AIRPORTS"
"7375","RNU","Ranau, Malaysia: Ranau Airport","AIRPORTS"
"7376","ROA","Roanoke, VA: Roanoke Municipal","AIRPORTS"
"7377","ROB","Monrovia, Liberia: Roberts International","AIRPORTS"
"7378","ROC","Rochester, NY: Rochester Monroe County","AIRPORTS"
"7379","ROG","Rogers, AR: Rogers Municipal Carter Field","AIRPORTS"
"7380","ROI","Unknown Code Description,","AIRPORTS"
"7381","ROK","Rockhampton, Australia: Rockhampton Airport","AIRPORTS"
"7382","ROL","Roosevelt, UT: Roosevelt Municipal","AIRPORTS"
"7383","ROM","Rome, Italy: Rome Airport","AIRPORTS"
"7384","RON","Rondon, Co,","AIRPORTS"
"7385","ROO","Rondonopolis, Brazil: Rondonopolis Airport","AIRPORTS"
"7386","ROP","Rota, TT: Rota International","AIRPORTS"
"7387","ROR","Koror, Palau: Babelthuap","AIRPORTS"
"7388","ROS","Rosario, Argentina: Rosario International","AIRPORTS"
"7389","ROT","Rotorua, New Zealand: Rotorua Airport","AIRPORTS"
"7390","ROU","Russe, Bulgaria: Bulg","AIRPORTS"
"7391","ROV","Rostov, Russia (European): Rostov Airport","AIRPORTS"
"7392","ROW","Roswell, NM: Two Link Ranch","AIRPORTS"
"7393","ROX","Roseau, MN: Roseau Municipal","AIRPORTS"
"7394","ROY","Unknown Code Description,","AIRPORTS"
"7395","RPM","Ngukurr, Au,","AIRPORTS"
"7396","RPN","Rosh-Pina, Israel: Izhak Ben Yaakov","AIRPORTS"
"7397","RPR","Raipur, India: Raipur Airport","AIRPORTS"
"7398","RPX","Roundup, MT: Roundup Airport","AIRPORTS"
"7399","RQA","Lone Pine, CA: Lone Pine Airport","AIRPORTS"
"7400","RQB","Atomic City, ID: Big Southern Butte","AIRPORTS"
"7401","RQC","Harlowton, MT: Wheatland County At Harlowton","AIRPORTS"
"7402","RQD","Mendota, CA: Mendota Airport","AIRPORTS"
"7403","RQE","Prosser, WA: Prosser Airport","AIRPORTS"
"7404","RQF","Lincolnton, NC: Lincoln County","AIRPORTS"
"7405","RQG","Covington, TN: Covington Municipal","AIRPORTS"
"7406","RQH","Perkasie, PA: Pennridge","AIRPORTS"
"7407","RQI","Nixon Fork Mine, AK: Nixon Fork Mine Airport","AIRPORTS"
"7408","RQJ","King Faisal Ab, Jordan: King Faisal Ab Airport","AIRPORTS"
"7409","RQK","China Lake, CA: China Lake Naws","AIRPORTS"
"7410","RQL","Lowell, IN: Lowell Airport","AIRPORTS"
"7411","RQM","Sterling, MA: Sterling Airport","AIRPORTS"
"7412","RQN","Cave Junction, OR: Illinois Valley","AIRPORTS"
"7413","RQO","Seneca, NY: Seneca Army Air Field","AIRPORTS"
"7414","RQP","Lovington, NM: Lea Co-Zip Franklin Memorial","AIRPORTS"
"7415","RQQ","Woodland, CA: Watts/Woodland","AIRPORTS"
"7416","RQR","Harbor Springs, MI: Harbor Springs Airport","AIRPORTS"
"7417","RQS","Barrie, Canada: Barrie Executive Airpark","AIRPORTS"
"7418","RQT","Lubbock, TX: Town and Country Airpark","AIRPORTS"
"7419","RQU","Wasco, CA: Wasco-Kern County","AIRPORTS"
"7420","RQV","Salt Lake City, UT: Salt Lake Municipal 2","AIRPORTS"
"7421","RQW","Parowan, UT: Parowan Airport","AIRPORTS"
"7422","RQX","Burlington, CO: Kit Carson County","AIRPORTS"
"7423","RQY","Comanche, TX: Comanche County-City","AIRPORTS"
"7424","RQZ","Mary Esther, FL: Hurlburt Field","AIRPORTS"
"7425","RRB","Bar, AK: Bar (Qar)","AIRPORTS"
"7426","RRG","Rodrigues Island, Rodrigues Islands-Mauritius: Rodrigues Mauritius","AIRPORTS"
"7427","RRK","Rourkela, India: Rourkela Airport","AIRPORTS"
"7428","RRS","Roros, Norway: Roros Airport","AIRPORTS"
"7429","RRT","Warroad, MN: Warroad International","AIRPORTS"
"7430","RSA","Santa Rosa, Argentina: Santa Rosa Airport","AIRPORTS"
"7431","RSC","Skulte, U.S.S.R. (European): Skulte","AIRPORTS"
"7432","RSD","Rock Sound, Bahamas: Rock Sound Airport","AIRPORTS"
"7433","RSH","Russian Mission, AK: Russian Mission Airport","AIRPORTS"
"7434","RSJ","Rosario, WA: Rosario Sea Plane Base","AIRPORTS"
"7435","RSN","Ruston, LA: Ruston Municipal","AIRPORTS"
"7436","RSP","Raspberry Strait, AK: Raspberry Straits","AIRPORTS"
"7437","RSS","Roseires, Sudan: Roseires","AIRPORTS"
"7438","RST","Rochester, MN: Rochester Municipal","AIRPORTS"
"7439","RSU","Yosu, South Korea: Yeosu","AIRPORTS"
"7440","RSW","Ft. Myers, FL: Southwest Florida International Airport","AIRPORTS"
"7441","RTA","Rotuma, Fiji Islands: Rotuma Airport","AIRPORTS"
"7442","RTB","Roatan Island, Honduras: Roatan Island Airport","AIRPORTS"
"7443","RTC","Unknown Code Description,","AIRPORTS"
"7444","RTE","Marguerite Bay, AK: Marguerite Bay Airport","AIRPORTS"
"7445","RTG","Ruteng, Id,","AIRPORTS"
"7446","RTI","Roti, Id,","AIRPORTS"
"7447","RTM","Rotterdam, Netherlands: Rotterdam Airport","AIRPORTS"
"7448","RTN","Raton, NM: Crews Field","AIRPORTS"
"7449","RTO","Colton, CA: Morrow Field","AIRPORTS"
"7450","RTS","Rottnest Island, Australia: Rottnest Island Airport","AIRPORTS"
"7451","RTW","Saratov, Ru,","AIRPORTS"
"7452","RU1","Keperveyeim, Russia (Asian): Keperveyeim Airport","AIRPORTS"
"7453","RU2","Ramenskoye, Russia (European): Ramenskoye Airport","AIRPORTS"
"7454","RUA","Unknown Code Description,","AIRPORTS"
"7455","RUG","Rugao, Cn,","AIRPORTS"
"7456","RUH","Riyadh, Saudi Arabia: King Khalid International","AIRPORTS"
"7457","RUI","Ruidoso, NM: Ruidoso","AIRPORTS"
"7458","RUM","Rumjartar, Np,","AIRPORTS"
"7459","RUN","Reunion Island, Reunion Island-France: St Denis/Gillot","AIRPORTS"
"7460","RUR","Rurutu Island, Pf,","AIRPORTS"
"7461","RUS","Marou, Sb,","AIRPORTS"
"7462","RUT","Rutland, VT: Rutland State","AIRPORTS"
"7463","RUV","Rubelsanto, Guatemala: Rubelsanto Airport","AIRPORTS"
"7464","RUY","Ruinas De Copan, Honduras: Copan Ruinas","AIRPORTS"
"7465","RVA","Farafangana, Madagascar: Farafangana Airport","AIRPORTS"
"7466","RVD","Rio Verde, Br,","AIRPORTS"
"7467","RVE","Saravena, Co,","AIRPORTS"
"7468","RVH","St. Petersburg, Ru,","AIRPORTS"
"7469","RVK","Rorvik, No,","AIRPORTS"
"7470","RVN","Rovaniemi, Finland: Rovaniemi Airport","AIRPORTS"
"7471","RVS","Tulsa, OK: Tulsa Riverside","AIRPORTS"
"7472","RVV","Papeete, French Polynesia,","AIRPORTS"
"7473","RVY","Rivera, Uruguay: Cerro Chapeu","AIRPORTS"
"7474","RWB","Rowan Bay, AK: Rowan Bay","AIRPORTS"
"7475","RWI","Rocky Mount, NC: Rocky Mount-Wilson","AIRPORTS"
"7476","RWL","Rawlins, WY: Rawlins Municipal","AIRPORTS"
"7477","RWN","Unknown Code Description,","AIRPORTS"
"7478","RWT","Georgetown, Guyana","AIRPORTS"
"7479","RXB","Rodman Bay, AK: Rodman Bay","AIRPORTS"
"7480","RXS","Roxas City, Philippines: Roxas","AIRPORTS"
"7481","RYE","Greeley, CO: Weld County Municipal","AIRPORTS"
"7482","RYG","Moss, Norway: Moss Rygge","AIRPORTS"
"7483","RYK","Rahim Yar Khan, Pakistan: Rahimyar Khan","AIRPORTS"
"7484","RYO","Unknown Code Description,","AIRPORTS"
"7485","RZA","Santa Cruz, Argentina: Santa Cruz Airport","AIRPORTS"
"7486","RZE","Rzeszow, Poland: Rzeszow Airport","AIRPORTS"
"7487","RZR","Ramsar, Iran: Ramsar Airport","AIRPORTS"
"7488","RZS","Sawan, Pakistan: Sawan Airport","AIRPORTS"
"7489","RZY","Rezayieh, Iran: Rezayieh Airport","AIRPORTS"
"7490","RZZ","Roanoke Rapids, NC: Halifax County","AIRPORTS"
"7491","SAA","Saratoga, WY: Shively Field","AIRPORTS"
"7492","SAB","Saba, Netherlands Antilles: Saba Island","AIRPORTS"
"7493","SAC","Sacramento, CA: Sacramento Executive","AIRPORTS"
"7494","SAD","Safford, AZ: Safford Municipal","AIRPORTS"
"7495","SAF","Santa Fe, NM: Santa Fe County Municipal","AIRPORTS"
"7496","SAG","Sagwon, AK: Sagwon Airport","AIRPORTS"
"7497","SAH","Sana'a, Yemen: Sana'a International","AIRPORTS"
"7498","SAI","Santiago De Los Caba: Santiago De Los Caballeros","AIRPORTS"
"7499","SAK","Saudarkrokur, Is,","AIRPORTS"
"7500","SAL","San Salvador, El Salvador: Ilopango","AIRPORTS"
"7501","SAM","Salamo, Papua New Guinea: Salamo Airport","AIRPORTS"
"7502","SAN","San Diego, CA: San Diego International","AIRPORTS"
"7503","SAO","Sao Paulo, Brazil: Sao Paulo Airport","AIRPORTS"
"7504","SAP","San Pedro Sula, Honduras: La Mesa International","AIRPORTS"
"7505","SAQ","San Andros, Bahamas: San Andros Airport","AIRPORTS"
"7506","SAT","San Antonio, TX: San Antonio International","AIRPORTS"
"7507","SAU","Sawu, Indonesia: Sawu Indonesia","AIRPORTS"
"7508","SAV","Savannah, GA: Savannah / Hilton Head International","AIRPORTS"
"7509","SAW","Sabiha Gokcen, Turkey: Sabiha Gokcen Airport","AIRPORTS"
"7510","SAX","Sambu, Panama Republic: Sambu Airport","AIRPORTS"
"7511","SAY","Harare, Zimbabwe: Harare Airport","AIRPORTS"
"7512","SBA","Santa Barbara, CA: Santa Barbara Municipal","AIRPORTS"
"7513","SBC","Selbang, Papua New Guinea: Selbang Airport","AIRPORTS"
"7514","SBD","San Bernardino, CA: Norton Air Force Base","AIRPORTS"
"7515","SBE","Suabi, Papua New Guinea,","AIRPORTS"
"7516","SBH","Gustavia, St. Barthelemy - France: Saint Barthelemy","AIRPORTS"
"7517","SBK","St. Brieuc, France: St Brieuc","AIRPORTS"
"7518","SBL","Santa Ana, Bolivia: Yacuma","AIRPORTS"
"7519","SBM","Sheboygan, WI: Sheboygan Memorial","AIRPORTS"
"7520","SBN","South Bend, IN: Michiana Regional","AIRPORTS"
"7521","SBO","Salina, UT: Salina-Gunnison","AIRPORTS"
"7522","SBP","San Luis Obispo/Paso Robles, CA: San Luis Obispo/Paso Robles Airport","AIRPORTS"
"7523","SBR","Saibai Island, Au,","AIRPORTS"
"7524","SBS","Steamboat Springs, CO: Steamboat Springs","AIRPORTS"
"7525","SBT","San Bernardino, CA: Tri-City","AIRPORTS"
"7526","SBU","Springbok, Republic Of South Africa: Springbok","AIRPORTS"
"7527","SBV","South Boston: William M Tuck","AIRPORTS"
"7528","SBW","Sibu, Malaysia: Sibu Airport","AIRPORTS"
"7529","SBY","Salisbury, MD: Salisbury Wicomico County","AIRPORTS"
"7530","SBZ","Sibiu, Romania: Sibiu Airport","AIRPORTS"
"7531","SC1","Beaufort, SC: Beaufort Mcas","AIRPORTS"
"7532","SC2","Winnsboro, SC: Winnsboro Airport","AIRPORTS"
"7533","SC3","Conway, SC: Conway-Horry  County","AIRPORTS"
"7534","SCC","Deadhorse, AK: Deadhorse Airport","AIRPORTS"
"7535","SCD","Sulaco, Honduras: Sulaco","AIRPORTS"
"7536","SCE","State College, PA: University Park","AIRPORTS"
"7537","SCF","Phoenix, AZ: Scottsdale Municipal","AIRPORTS"
"7538","SCH","Schenectady, NY: Schenectady County","AIRPORTS"
"7539","SCI","San Cristobal, Venezuela: San Cristobal Airport","AIRPORTS"
"7540","SCJ","Smith Cove, AK: Smith Cove Airport","AIRPORTS"
"7541","SCK","Stockton, CA: Stockton Metropolitan","AIRPORTS"
"7542","SCL","Santiago, Chile: Arturo Merino Benitz","AIRPORTS"
"7543","SCM","Scammon Bay, AK: Scammon Bay Airport","AIRPORTS"
"7544","SCN","Saarbrucken, Germany: Saarbrucken Ensheim","AIRPORTS"
"7545","SCO","Shevchenko, Kazakhstan: Shevchenko Airport","AIRPORTS"
"7546","SCQ","Santiago De Compostela, Spain: Santiago","AIRPORTS"
"7547","SCT","Socotra, Ye,","AIRPORTS"
"7548","SCU","Santiago, Cuba: Antonio Maceo","AIRPORTS"
"7549","SCV","Suceava, Romania: Suceava Airport","AIRPORTS"
"7550","SCW","Syktyvkar, Ru,","AIRPORTS"
"7551","SCX","Salina Cruz, Mexico: Salina Cruz Airport","AIRPORTS"
"7552","SCY","San Cristobal, Ecuador: San Cristobal Airport","AIRPORTS"
"7553","SCZ","Nendo, Sb,","AIRPORTS"
"7554","SD1","Onida, SD: Onida Municipal","AIRPORTS"
"7555","SDA","Baghdad, Iraq: Baghdad International","AIRPORTS"
"7556","SDD","Lubango, Angola: Sa Da Bandeira","AIRPORTS"
"7557","SDE","Santiago Del Estero, Argentina: Santiago Del Estero Airport","AIRPORTS"
"7558","SDF","Louisville, KY: Standiford Field","AIRPORTS"
"7559","SDG","Sanandaj, Iran: Sanandaj Airport","AIRPORTS"
"7560","SDH","Santa Rosa De Copan, Honduras: Santa Rosa De Copan Airport","AIRPORTS"
"7561","SDI","Saidor, Pg,","AIRPORTS"
"7562","SDJ","Sendai, Japan: Sendai Airport","AIRPORTS"
"7563","SDK","Sandakan, Malaysia: Sandakan Airport","AIRPORTS"
"7564","SDL","Sundsvall, Sweden: Sudsvall Harnosand","AIRPORTS"
"7565","SDM","San Diego, CA: Brown Field Municipal","AIRPORTS"
"7566","SDN","Sandane, Norway: Sandane","AIRPORTS"
"7567","SDP","Sandpoint, AK: Sand Point","AIRPORTS"
"7568","SDQ","Santo Domingo, Dominican Republic: De Las Americas International","AIRPORTS"
"7569","SDR","Santander, Spain: Santander Airport","AIRPORTS"
"7570","SDT","Saidu Sharif, Pakistan: Saidu Sharif Airport","AIRPORTS"
"7571","SDU","Rio De Janeiro, Brazil: Santos Dumont","AIRPORTS"
"7572","SDV","Sde Dov, Israel: Sde Dov A/D Tel Aviv Israel","AIRPORTS"
"7573","SDX","Sedona, AZ: Sedona Airport","AIRPORTS"
"7574","SDY","Sidney, MT: Sidney/Richland Municipal","AIRPORTS"
"7575","SE1","Solleftea, Sweden: Solleftea Airport","AIRPORTS"
"7576","SEA","Seattle, WA: Seattle/Tacoma International","AIRPORTS"
"7577","SEB","Sebha, Libya: Sebha Airport","AIRPORTS"
"7578","SEE","San Diego, CA: Gillespie Field","AIRPORTS"
"7579","SEF","Sebring, FL: Sebring  and Industrial","AIRPORTS"
"7580","SEG","Selinsgrove, PA: Penn Valley","AIRPORTS"
"7581","SEL","Seoul, South Korea: Kimpo International","AIRPORTS"
"7582","SEM","Selma, AL: Craig Air Force Base","AIRPORTS"
"7583","SEN","Southend-On-Sea, United Kingdom: Southend","AIRPORTS"
"7584","SEQ","Sungai Pakning, Indonesia: Sungaipakning","AIRPORTS"
"7585","SER","Seymour, IN: Freeman Municipal","AIRPORTS"
"7586","SES","Selma, AL: Selfield","AIRPORTS"
"7587","SEU","Unknown Code Description,","AIRPORTS"
"7588","SEY","Selibaby, Mauritania: Selibabi","AIRPORTS"
"7589","SEZ","Mahe Islands, Seychelles Islands: Seychelles International","AIRPORTS"
"7590","SFA","Sfax, Tunisia: El Maou","AIRPORTS"
"7591","SFB","Sanford, FL: Ramey Nas","AIRPORTS"
"7592","SFC","St. Francois, Guadeloupe-France: St. Francois Airport","AIRPORTS"
"7593","SFD","San Fernando, Venezuela: San Fernando De Apure","AIRPORTS"
"7594","SFE","San Fernando, Ph,","AIRPORTS"
"7595","SFF","Spokane, WA: Felts Field","AIRPORTS"
"7596","SFG","Marigot, St. Martin - France: Esperance","AIRPORTS"
"7597","SFH","San Felipe, Mexico: San Felipe Airport","AIRPORTS"
"7598","SFI","Safi, Morocco,","AIRPORTS"
"7599","SFJ","Sondre Stromfjord, Greenland - Denmark: Sondrestrom Air Base","AIRPORTS"
"7600","SFK","Stony Fork: Aero Acres","AIRPORTS"
"7601","SFL","Sao Filipe, Cape Verde Islands: Sao Filipe Airport","AIRPORTS"
"7602","SFM","Sanford, ME: Sanford Municipal","AIRPORTS"
"7603","SFN","Santa Fe, Argentina: Esperanza","AIRPORTS"
"7604","SFO","San Francisco, CA: San Francisco International","AIRPORTS"
"7605","SFP","Surfers Paradise, Australia: Surfers Paradise Airport","AIRPORTS"
"7606","SFQ","Sanliurfa, Tr,","AIRPORTS"
"7607","SFS","Subic Bay, Philippines: Subic Bay International","AIRPORTS"
"7608","SFT","Skelleftea, Sweden: Skelleftea Airport","AIRPORTS"
"7609","SFU","Safia, Papua New Guinea: Safia Airport","AIRPORTS"
"7610","SFW","Santa Fe, Panama Republic: Santa Fe Airport","AIRPORTS"
"7611","SFZ","Smithfield, RI: North Central State","AIRPORTS"
"7612","SGB","Singaua, Papua New Guinea: Singaua Airport","AIRPORTS"
"7613","SGC","Surgut, Russia (Asian): Surgut Airport","AIRPORTS"
"7614","SGD","Sonderborg, Denmark: Sonderborg Old","AIRPORTS"
"7615","SGE","Siegen, Germany: Siegerland","AIRPORTS"
"7616","SGF","Springfield, MO: Springfield Regional","AIRPORTS"
"7617","SGG","Simanggang, Malaysia: Simanggang","AIRPORTS"
"7618","SGH","Springfield, OH: Springfield Municipal","AIRPORTS"
"7619","SGJ","Sagarai, Papua New Guinea: Sagarai Airport","AIRPORTS"
"7620","SGK","Sangapi, Pg,","AIRPORTS"
"7621","SGL","Sangley Point, Philippines: Sangley Point Ab","AIRPORTS"
"7622","SGM","San Ignacio, Mexico: San Ignacio Airport","AIRPORTS"
"7623","SGN","Ho Chi Minh City, Vietnam: Tan Son Nhat International","AIRPORTS"
"7624","SGO","St. George, Australia: St. George Airport","AIRPORTS"
"7625","SGP","Shay Gap, Australia: Shay Gap Airport","AIRPORTS"
"7626","SGR","Sugar Land, TX: Sugar Land/Hull Field","AIRPORTS"
"7627","SGS","Sanga Sanga, Philippines,","AIRPORTS"
"7628","SGT","Stuttgart, AR: Stuttgart Municipal","AIRPORTS"
"7629","SGU","St. George, UT: St George Municipal","AIRPORTS"
"7630","SGW","Saginaw Bay, AK: Saginaw","AIRPORTS"
"7631","SGX","Songea, Tanzania: Songea Airport","AIRPORTS"
"7632","SGY","Skagway, AK: Skagway Airport","AIRPORTS"
"7633","SGZ","Singora, Thailand: Songkhla","AIRPORTS"
"7634","SHA","Shanghai, China: Hongqiao International","AIRPORTS"
"7635","SHB","Nakashibetsu, Japan: Nakashibetsu Airport","AIRPORTS"
"7636","SHC","Indaselassie, Ethiopia: Shire","AIRPORTS"
"7637","SHD","Staunton, VA: Shenandoah Valley","AIRPORTS"
"7638","SHE","Shenyang, China: Shenyang Airport","AIRPORTS"
"7639","SHG","Shungnak, AK: Shungnak Airport","AIRPORTS"
"7640","SHH","Shishmaref, AK: Shishmaref Airport","AIRPORTS"
"7641","SHI","Shimojishima, Japan: Shimojishima Airport","AIRPORTS"
"7642","SHJ","Sharjah, United Arab Emirates: Sharjah Airport","AIRPORTS"
"7643","SHL","Shillong, India: Shillong Airport","AIRPORTS"
"7644","SHM","Nanki Shirahama, Japan: Nanki Shirahama Airport","AIRPORTS"
"7645","SHN","Shelton, WA: Sanderson Field","AIRPORTS"
"7646","SHO","Sokcho, South Korea: Sokcho/R-407","AIRPORTS"
"7647","SHP","Qinhuangdao, Cn,","AIRPORTS"
"7648","SHR","Sheridan, WY: Sheridan County","AIRPORTS"
"7649","SHS","Shashi, Cn,","AIRPORTS"
"7650","SHT","Shepparton, Au,","AIRPORTS"
"7651","SHU","Shute Harbour, Australia: Shute Harbour Aust.","AIRPORTS"
"7652","SHV","Shreveport, LA: Shreveport Regional","AIRPORTS"
"7653","SHW","Sharurah, Saudi Arabia: Sharurah Airport","AIRPORTS"
"7654","SHX","Shageluk, AK: Shageluk Airport","AIRPORTS"
"7655","SHY","Unknown Code Description,","AIRPORTS"
"7656","SIA","Xi An, China: Xi An Xiguan","AIRPORTS"
"7657","SIB","Sibiti, Cg,","AIRPORTS"
"7658","SIC","Sinop, Tr,","AIRPORTS"
"7659","SID","Sal Island, Cape Verde Islands: Amilcar Cabral International","AIRPORTS"
"7660","SIF","Simra, Np,","AIRPORTS"
"7661","SIG","San Juan, PR: Isla Grande","AIRPORTS"
"7662","SIH","Silgadi Doti, Nepal: Silgarhi Doti","AIRPORTS"
"7663","SII","Sidi Ifni, Morocco: Sidi Ifni Airport","AIRPORTS"
"7664","SIJ","Siglufjordur, Is,","AIRPORTS"
"7665","SIK","Sikeston, MO: Sikeston Memorial Municipal","AIRPORTS"
"7666","SIL","Sila, Pg,","AIRPORTS"
"7667","SIM","Simbai, Papua New Guinea: Simbai Airport","AIRPORTS"
"7668","SIN","Singapore, Singapore: Changi","AIRPORTS"
"7669","SIO","Smithton, Australia: Smithton Airport","AIRPORTS"
"7670","SIP","Simferopol, Ukraine: Simferopol Airport","AIRPORTS"
"7671","SIR","Sion, Ch,","AIRPORTS"
"7672","SIS","Sishen, Republic Of South Africa: Sishen Airport","AIRPORTS"
"7673","SIT","Sitka, AK: Sitka Harbor Sea Plane Base","AIRPORTS"
"7674","SIU","Siuna, Nicaragua: Siuna Airport","AIRPORTS"
"7675","SIX","Singleton, Au,","AIRPORTS"
"7676","SIY","Montague, CA: Siskiyou County","AIRPORTS"
"7677","SJB","San Joaquin, Bo,","AIRPORTS"
"7678","SJC","San Jose, CA: San Jose International","AIRPORTS"
"7679","SJD","San Jose Del Cabo, Mexico: Los Cabos International","AIRPORTS"
"7680","SJE","San Jose Del Guaviare, Co,","AIRPORTS"
"7681","SJF","St. John, VI: St. John Airport","AIRPORTS"
"7682","SJI","San Jose, Philippines: San Jose Airport","AIRPORTS"
