"3640","EWB","New Bedford/Fall River, MA: New Bedford Municipal","AIRPORTS"
"3641","EWE","Ewer, Id,","AIRPORTS"
"3642","EWI","Enarotali, Id,","AIRPORTS"
"3643","EWK","Newton, KS: Newton City County","AIRPORTS"
"3644","EWN","New Bern/Morehead/Beaufort, NC: Craven County Regional","AIRPORTS"
"3645","EWR","Newark, NJ: Newark Liberty International","AIRPORTS"
"3646","EXI","Excursion Inlet, AK: Excursion Inlet Seaplane Base","AIRPORTS"
"3647","EXM","Unknown Code Description,","AIRPORTS"
"3648","EXT","Exeter, United Kingdom: Exter","AIRPORTS"
"3649","EXU","Exuma, Bahamas: Exuma International","AIRPORTS"
"3650","EYL","Yelimane, Mali: Yelimane Airport","AIRPORTS"
"3651","EYP","El Yopal, Colombia: El Yopal Airport","AIRPORTS"
"3652","EYR","Yerington, NV: Yerington Municipal","AIRPORTS"
"3653","EYW","Key West, FL: Key West International","AIRPORTS"
"3654","EZE","Buenos Aires, Argentina: Ministro Pistarini","AIRPORTS"
"3655","EZS","Elazig, Turkey: Elazig Airport","AIRPORTS"
"3656","FAB","Farnborough, United Kingdom: Farnborough Airport","AIRPORTS"
"3657","FAE","Sorvagur, Denmark: Vagar","AIRPORTS"
"3658","FAI","Fairbanks, AK: Fairbanks International","AIRPORTS"
"3659","FAJ","Fajardo, PR: Fajardo Airport","AIRPORTS"
"3660","FAK","False Island, AK: False Island Airport","AIRPORTS"
"3661","FAL","Roma, TX: Falcon State Park","AIRPORTS"
"3662","FAM","Farmington, MO: Farmington Regional","AIRPORTS"
"3663","FAN","Farsund, Norway: Lista","AIRPORTS"
"3664","FAO","Faro, Portugal: Faro Airport","AIRPORTS"
"3665","FAQ","Freida River, Pg,","AIRPORTS"
"3666","FAR","Fargo, ND: Hector Field","AIRPORTS"
"3667","FAT","Fresno, CA: Fresno Air Terminal","AIRPORTS"
"3668","FAU","Fairmont Island , AK: Fairmount Island","AIRPORTS"
"3669","FAV","Fakarava, French Polynesia: Fakaraua","AIRPORTS"
"3670","FAY","Fayetteville, NC: Fayetteville Municipal","AIRPORTS"
"3671","FAZ","Teheran, Iran,","AIRPORTS"
"3672","FBE","Francisco Beltrao, Br,","AIRPORTS"
"3673","FBG","Fort Bragg, NC: Simmons Air Force Base","AIRPORTS"
"3674","FBK","Fairbanks, AK: Ft. Wainwright Army Air Field","AIRPORTS"
"3675","FBM","Lubumbashi, Republic Of Congo: Lubumbashi Airport","AIRPORTS"
"3676","FBR","Fort Bridger, WY: Fort Bridger Airport","AIRPORTS"
"3677","FBS","Friday Harbor, WA: Friday Harbor Seaplane Base","AIRPORTS"
"3678","FBU","Oslo, Norway: Fornebu","AIRPORTS"
"3679","FCA","Kalispell, MT: Glacier Park International","AIRPORTS"
"3680","FCH","Fresno, CA: Chandler Downtown","AIRPORTS"
"3681","FCM","Minneapolis, MN: Flying Cloud","AIRPORTS"
"3682","FCO","Rome, Italy: Leonardo Da Vinci","AIRPORTS"
"3683","FCS","Colorado Springs, CO: Butts Army Air Field","AIRPORTS"
"3684","FDE","Forde, Norway: Forde Airport","AIRPORTS"
"3685","FDF","Fort De France, Martinique-France: Le Lamentin","AIRPORTS"
"3686","FDH","Friedrichshafen, Germany: Friedrichshafen/Lowenthal","AIRPORTS"
"3687","FDK","Frederick, MD: Frederick Municipal","AIRPORTS"
"3688","FDR","Frederick, OK: Frederick Municipal","AIRPORTS"
"3689","FDU","Bandundu, Republic Of Congo: Bandundu Airport","AIRPORTS"
"3690","FDY","Findlay, OH: Findlay Airport","AIRPORTS"
"3691","FEB","Sanfebagar, Np,","AIRPORTS"
"3692","FEG","Fergana, Uzbekistan: Fergana Airport","AIRPORTS"
"3693","FEJ","Feijo, Br,","AIRPORTS"
"3694","FEN","Fernando De Noronha, Brazil: Fernando De Noronha Airport","AIRPORTS"
"3695","FEP","Freeport, IL: Albertus","AIRPORTS"
"3696","FET","Fremont, NE: Fremont Municipal","AIRPORTS"
"3697","FEW","Cheyenne, WY: Warren Air Force Base","AIRPORTS"
"3698","FEZ","Fez, Morocco: Saiss","AIRPORTS"
"3699","FFD","Fairford, United Kingdom: Fairford Airport","AIRPORTS"
"3700","FFM","Fergus Falls, MN: Fergus Falls Municipal","AIRPORTS"
"3701","FFO","Dayton, OH: Wright/Patterson Air Force Base","AIRPORTS"
"3702","FFT","Frankfort, KY: Capital City","AIRPORTS"
"3703","FGD","Fderick, Mauritania: Fderick Airport","AIRPORTS"
"3704","FGI","Apia, Western Samoa: Fagali I","AIRPORTS"
"3705","FGL","Fox Glacier, Nz,","AIRPORTS"
"3706","FHI","Fishers Island: Elizabeth Field","AIRPORTS"
"3707","FHU","Fort Huachuca, AZ: Libby Army Air Field /Sierra Vista Municipal","AIRPORTS"
"3708","FIC","Fire Cove, AK: Fire Cove Airport","AIRPORTS"
"3709","FID","Fishers Island, NY: Elizabeth Field","AIRPORTS"
"3710","FIE","Fair Isle, Gb,","AIRPORTS"
"3711","FIH","Kinshasa, Republic Of Congo: N","AIRPORTS"
"3712","FIL","Fillmore, UT: Fillmore","AIRPORTS"
"3713","FIN","Finschhafen, Papua New Guinea: Finschhafen Airport","AIRPORTS"
"3714","FIZ","Fitzroy Crossing, Australia: Fitzroy Crossing Airport","AIRPORTS"
"3715","FJM","Chipata, Zambia: Chipata Airport","AIRPORTS"
"3716","FJR","Al-Fujairah, United Arab Emirates: Fujairah International","AIRPORTS"
"3717","FKB","Karlsruhe/Baden Baden, Germany: Baden Baden","AIRPORTS"
"3718","FKI","Kisangani, Republic Of Congo: Kisangani Airport","AIRPORTS"
"3719","FKJ","Fukui, Japan: Fukui Airport","AIRPORTS"
"3720","FKL","Franklin/Oil City, PA: Venango Regional","AIRPORTS"
"3721","FKQ","Fak Fak, Id,","AIRPORTS"
"3722","FKS","Fukushima, Japan: Fukushima Airport","AIRPORTS"
"3723","FL1","Zephyrhills, FL: Zephyrhills Municipal","AIRPORTS"
"3724","FL2","Valkaria, FL: Valkaria","AIRPORTS"
"3725","FL3","Chipley, FL: Vosikas","AIRPORTS"
"3726","FL4","Bunnell, FL: Flagler County","AIRPORTS"
"3727","FL5","Williston, FL: Williston Municipal","AIRPORTS"
"3728","FLA","Florencia, Colombia: Florencia Airport","AIRPORTS"
"3729","FLB","Floriano, Brazil: Floriano Airport","AIRPORTS"
"3730","FLC","Falls Creek, Au,","AIRPORTS"
"3731","FLD","Fond Du Lac, WI: Fond Du Lac County","AIRPORTS"
"3732","FLF","Flensburg, Germany: Flensburg/Schaferhaus","AIRPORTS"
"3733","FLG","Flagstaff, AZ: Grand Canyon Pulliam Field","AIRPORTS"
"3734","FLJ","Falls Bay, AK: Falls Bay Airport","AIRPORTS"
"3735","FLL","Fort Lauderdale, FL: Fort Lauderdale International","AIRPORTS"
"3736","FLN","Florianopolis, Brazil: Hercilio Luz","AIRPORTS"
"3737","FLO","Florence, SC: Florence City County","AIRPORTS"
"3738","FLR","Florence, Italy: Firenze/Peretola","AIRPORTS"
"3739","FLS","Flinders Island , Australia: Flinders Island","AIRPORTS"
"3740","FLT","Flat, AK: Flat Airport","AIRPORTS"
"3741","FLU","New York, NY: Flushing","AIRPORTS"
"3742","FLV","Leavenworth, KS: Herman Army Air Field","AIRPORTS"
"3743","FLW","Santa Cruz, Portugal: Santa Cruz","AIRPORTS"
"3744","FLX","Fallon, NV: Fallon Municipal","AIRPORTS"
"3745","FMA","Formosa, Argentina: Formosa Airport","AIRPORTS"
"3746","FMC","Five Mile Camp, AK: Five Mile Camp Airport","AIRPORTS"
"3747","FMG","Flamingo, Cr,","AIRPORTS"
"3748","FMH","Falmouth, MA: Otis Air Force Base","AIRPORTS"
"3749","FMI","Kalemie, Republic Of Congo: Kalima","AIRPORTS"
"3750","FMN","Farmington, NM: Farmington Municipal","AIRPORTS"
"3751","FMO","Muenster, Germany: Munster/Osnabruck","AIRPORTS"
"3752","FMS","Fort Madison, IA: Fort Madison","AIRPORTS"
"3753","FMY","Fort Myers, FL: Page Field","AIRPORTS"
"3754","FNA","Freetown, Sierra Leone: Freetown Airport","AIRPORTS"
"3755","FNB","Unknown Code Description,","AIRPORTS"
"3756","FNC","Funchal, Portugal: Funchal Airport","AIRPORTS"
"3757","FNE","Fane, Pg,","AIRPORTS"
"3758","FNI","Nimes, France: Nimes/Garons","AIRPORTS"
"3759","FNJ","Pyong Yang, North Korea: Pyong Yang Airport","AIRPORTS"
"3760","FNL","Ft. Collins/Loveland, CO: Ft. Collins/Loveland Municipal","AIRPORTS"
"3761","FNR","Funter Bay Alaska, AK: Funter Bay","AIRPORTS"
"3762","FNT","Flint, MI: Bishop","AIRPORTS"
"3763","FOA","Fortuna Ledge, AK: Marshall Field","AIRPORTS"
"3764","FOB","Fort Bragg, CA: Fort Bragg Airport","AIRPORTS"
"3765","FOC","Fuzhou, China: Fuzhou Airport","AIRPORTS"
"3766","FOD","Fort Dodge, IA: Fort Dodge Municipal","AIRPORTS"
"3767","FOE","Topeka, KS: Forbes A.F.B.","AIRPORTS"
"3768","FOG","Foggia, Italy: Foggia Airport","AIRPORTS"
"3769","FOK","Westhampton, NY: Suffolk County","AIRPORTS"
"3770","FOL","Folger, AK: Folger Airport","AIRPORTS"
"3771","FON","Fortuna, Cr,","AIRPORTS"
"3772","FOO","Numfoor, Id,","AIRPORTS"
"3773","FOR","Fortaleza, Brazil: Pinto Martins","AIRPORTS"
"3774","FOT","Forster, Au,","AIRPORTS"
"3775","FOU","Fougamou, Ga,","AIRPORTS"
"3776","FPO","Freeport, Bahamas: Grand Bahama International","AIRPORTS"
"3777","FPR","Fort Pierce, FL: St Lucie County","AIRPORTS"
"3778","FPY","Perry, FL: Perry-Foley","AIRPORTS"
"3779","FQA","Patching Lake, AK: Patching Lake Airport","AIRPORTS"
"3780","FQB","Ventura, CA: San Nicolas Island","AIRPORTS"
"3781","FQC","Lilly Lake, AK: Lilly Lake Airport","AIRPORTS"
"3782","FQD","Trident Volcano, AK: Trident Volcano Airport","AIRPORTS"
"3783","FQE","Annex Creek, AK: Annex Creek Airport","AIRPORTS"
"3784","FQF","Davidson Creek, AK: Davidson Creek Airport","AIRPORTS"
"3785","FQG","Snettisham, AK: Snettisham Airport","AIRPORTS"
"3786","FQH","Fire Island, AK: Fire Island Airport","AIRPORTS"
"3787","FQI","Scott, KY: Georgetown Scott County","AIRPORTS"
"3788","FQJ","Greens Creek, AK: Greens Creek Airport","AIRPORTS"
"3789","FQK","Gull Cove, AK: Gull Cove Airport","AIRPORTS"
"3790","FQL","Flora, IL: Flora Municipal","AIRPORTS"
"3791","FQM","Lakenheath, United Kingdom: Lakenheath Airport","AIRPORTS"
"3792","FQN","Karta Lake, AK: Karta Lake Airport","AIRPORTS"
"3793","FQO","Manzanita Lake, AK: Manzanita Lake Airport","AIRPORTS"
"3794","FQP","Shrimp Bay, AK: Shrimp Bay Airport","AIRPORTS"
"3795","FQQ","Dry Bay, AK: Dry Bay Airport","AIRPORTS"
"3796","FQR","Josephine Lake, AK: Josephine Lake Airport","AIRPORTS"
"3797","FQS","Mt. St. Elias, AK: Mt. St. Elias Airport","AIRPORTS"
"3798","FQT","Humpback Lake, AK: Humpback Lake Airport","AIRPORTS"
"3799","FQU","Libby, MT: Libby Airport","AIRPORTS"
"3800","FQV","Volcano Bay, AK: Volcano Bay Airport","AIRPORTS"
"3801","FQW","Fort Glenn, AK: Fort Glenn Airport","AIRPORTS"
"3802","FQX","Babe Islands, AK: Babe Islands Airport","AIRPORTS"
"3803","FQY","Kahli Cove, AK: Kahli Cove Airport","AIRPORTS"
"3804","FQZ","Tenass Pass, AK: Tenass Pass Airport","AIRPORTS"
"3805","FRA","Frankfurt, Germany: Frankfurt International","AIRPORTS"
"3806","FRB","Forbes, Au,","AIRPORTS"
"3807","FRC","Franca, Brazil: Franca Airport","AIRPORTS"
"3808","FRD","Friday Harbor, WA: Friday Harbor Airport","AIRPORTS"
"3809","FRE","Fera, Sb,","AIRPORTS"
"3810","FRF","Frankfurt, Germany: Rhein-Main Air Force Base","AIRPORTS"
"3811","FRG","Farmingdale, NY: Republic Field","AIRPORTS"
"3812","FRJ","Frejus, Fr,","AIRPORTS"
"3813","FRL","Forli, Italy: Forli Airport","AIRPORTS"
"3814","FRM","Fairmont, MN: Fairmont Municipal","AIRPORTS"
"3815","FRO","Floro, Norway: Floro Airport","AIRPORTS"
"3816","FRP","Fresh Water Bay, AK: Fresh Water Bay Airport","AIRPORTS"
"3817","FRR","Front Royal, VA: Front Royal Airport","AIRPORTS"
"3818","FRS","Flores, Guatemala: Flores Airport","AIRPORTS"
"3819","FRU","Bishkek, Kyrgyzstan: Bishkek Airport","AIRPORTS"
"3820","FRW","Francistown, Botswana: Francistown Airport","AIRPORTS"
"3821","FRY","Fryeburg, ME: Eastern Slopes Regional","AIRPORTS"
"3822","FSC","Figari, France: Sud Corse","AIRPORTS"
"3823","FSD","Sioux Falls, SD: Regional Joe Foss Field","AIRPORTS"
"3824","FSI","Fort Sill, OK: Henry Post Army Air Field","AIRPORTS"
"3825","FSK","Fort Scott, KY: Fort Scott Municipal","AIRPORTS"
"3826","FSM","Fort Smith, AR: Fort Smith Regional","AIRPORTS"
"3827","FSP","St.Pierre, St. Pierre Et Miquelon-France: St. Pierre","AIRPORTS"
"3828","FST","Ft. Stockton, TX: Fort Stockton Pecos County","AIRPORTS"
"3829","FTA","Futuna Island, Vu,","AIRPORTS"
"3830","FTC","Ft. Collins, CO: Fort Collins Airpark","AIRPORTS"
"3831","FTE","El Calafate, Argentina: El Calafate Airport","AIRPORTS"
"3832","FTG","Denver, CO: Front Range","AIRPORTS"
"3833","FTK","Fort Knox, KY: Godman Army Air Field","AIRPORTS"
"3834","FTL","Fortuna Ledge, AK: Fortuna Ledge Airport","AIRPORTS"
"3835","FTR","Fort Archambault, Chad: Sarh","AIRPORTS"
"3836","FTU","Fort Dauphin, Madagascar: Marillac","AIRPORTS"
"3837","FTV","Masvingo, Zimbabwe: Masvingo Airport","AIRPORTS"
"3838","FTW","Dallas/Ft.Worth, TX: Fort Worth Meacham","AIRPORTS"
"3839","FTX","Owando, Cg,","AIRPORTS"
"3840","FTY","Atlanta, GA: Fulton County/Brown","AIRPORTS"
"3841","FUB","Fulleborn, Pg,","AIRPORTS"
"3842","FUE","Fuerteventura, Spain: Fuerteventura Airport","AIRPORTS"
"3843","FUG","Unknown Code Description,","AIRPORTS"
"3844","FUJ","Fukue, Japan: Fukue Airport","AIRPORTS"
"3845","FUK","Fukuoka, Japan: Fukuoka Airport","AIRPORTS"
"3846","FUL","Fullerton, CA: Fullerton Municipal","AIRPORTS"
"3847","FUN","Funafuti, Tuvalu-UK: Funafuti International","AIRPORTS"
"3848","FUO","Fuoshan, Cn,","AIRPORTS"
"3849","FUT","Futuna, Wallis and Futuna Islands-France: Futuna Airport","AIRPORTS"
"3850","FVA","Osprey Lodge, AK: Osprey Lodge Airport","AIRPORTS"
"3851","FVB","Baledogle, Somalia: Baledogle Airport","AIRPORTS"
"3852","FVC","Baikonour, Kazakhstan: Baikonour Airport","AIRPORTS"
"3853","FVD","Sonora, TX: Sonora Municipal","AIRPORTS"
"3854","FVE","Fallbrook, CA: Fallbrook Community Airpark","AIRPORTS"
"3855","FVF","Dadaab, Kenya: Hagadera","AIRPORTS"
"3856","FVG","Wickenburg, AZ: Wickenburg Municipal","AIRPORTS"
"3857","FVH","Othello, WA: Othello Municipal","AIRPORTS"
"3858","FVI","Lake Providence, LA: Byerley","AIRPORTS"
"3859","FVJ","Amberley, Australia: Amberley Airport","AIRPORTS"
"3860","FVK","Jasper, AK: Jasper Airport","AIRPORTS"
"3861","FVL","Colusa, CA: Colusa","AIRPORTS"
"3862","FVM","Erwin, NC: Harnett County","AIRPORTS"
"3863","FVN","Culbertson, MT: Big Sky Field","AIRPORTS"
"3864","FVO","Aurora, OR: Aurora State","AIRPORTS"
"3865","FVP","Quincy, CA: Gansner Field","AIRPORTS"
"3866","FVQ","Donlin Creek Mine, AK: Donlin Creek Mine Airport","AIRPORTS"
"3867","FVR","Three Forks, MT: Three Forks Airport","AIRPORTS"
"3868","FVS","Rexburg, ID: Rexburg-Madison County","AIRPORTS"
"3869","FVT","Latacunga, Ecuador: Latacunga Airport","AIRPORTS"
"3870","FVU","Las Palmas, Peru: Las Palmas Airport","AIRPORTS"
"3871","FVV","Kernville, CA: Kern Valley","AIRPORTS"
"3872","FVW","Golden Creek Mine, AK: Golden Creek Mine Airport","AIRPORTS"
"3873","FVX","Grace Harbor, AK: Grace Harbor Airport","AIRPORTS"
"3874","FVY","Unuk River, AK: Unuk River Airport","AIRPORTS"
"3875","FVZ","Inagok, AK: Inagok Airport","AIRPORTS"
"3876","FWA","Fort Wayne, IN: Fort Wayne Muni/Baer Field","AIRPORTS"
"3877","FWH","Dallas/Ft.Worth, TX: Carswell Air Force Base","AIRPORTS"
"3878","FWL","Farewell, AK: Farewell Airport","AIRPORTS"
"3879","FWS","Forth Worth, TX: Forth Worth Spinks","AIRPORTS"
"3880","FXE","Fort Lauderdale, FL: Ft Lauderdale Executive","AIRPORTS"
"3881","FXM","Flaxman Island, AK: Flaxman Afs","AIRPORTS"
"3882","FXO","Nova Freixo, Mozambique: Nova Freixo Airport","AIRPORTS"
"3883","FXR","Clinton, IN: Frankfort Municipal","AIRPORTS"
"3884","FXY","Forest City, IA: Forest City Municipal","AIRPORTS"
"3885","FYA","Faya Largeau, Chad: Faya Largeau Airport","AIRPORTS"
"3886","FYN","Fuyun, Cn,","AIRPORTS"
"3887","FYT","Faya, Chad: Faya","AIRPORTS"
"3888","FYU","Fort Yukon, AK: Fort Yukon Airport","AIRPORTS"
"3889","FYV","Fayetteville, AR: Drake Field","AIRPORTS"
"3890","FYX",,"AIRPORTS"
"3891","FZB","Mansa, Zambia: Mansa Airport","AIRPORTS"
"3892","FZO","Filton, United Kingdom: Filton Airport","AIRPORTS"
"3893","GA1","Lafayette, GA: Barwick Lafayette","AIRPORTS"
"3894","GA2","Carrollton, GA: West Georgia Regional - O V Gray Field","AIRPORTS"
"3895","GA3","Atlanta, GA: Newnan Coweta County","AIRPORTS"
"3896","GAC","Gracias, Honduras: Gracias Airport","AIRPORTS"
"3897","GAD","Gadsden, AL: Gadsen Municipal","AIRPORTS"
"3898","GAF","Unknown Code Description,","AIRPORTS"
"3899","GAI","Gaithersburg, MD: Montgomery County Airpark","AIRPORTS"
"3900","GAJ","Yamagata, Japan: Yamagata","AIRPORTS"
"3901","GAL","Galena, AK: Galena Airport","AIRPORTS"
"3902","GAM","Gambell, AK: Gambell Airport","AIRPORTS"
"3903","GAN","Gan Island Raf Sta., Maldives: Gan Island Raf Sta. Airport","AIRPORTS"
"3904","GAO","Guantanamo, Cuba: Los Canos","AIRPORTS"
"3905","GAQ","Gao, Mali: Gao Airport","AIRPORTS"
"3906","GAR","Garaina, Papua New Guinea: Garaina Airport","AIRPORTS"
"3907","GAS","Garissa, Ke,","AIRPORTS"
"3908","GAT","Gap, France: Tallard","AIRPORTS"
"3909","GAU","Gauhati, India: Gauhati Airport","AIRPORTS"
"3910","GAW","Gangaw, Myanmar: Gangaw Airport","AIRPORTS"
"3911","GAX","Gamba, Ga,","AIRPORTS"
"3912","GAY","Gaya, India: Gaya Airport","AIRPORTS"
"3913","GAZ","Guasopa, Pg,","AIRPORTS"
"3914","GB1","Suffolk, United Kingdom: Raf Wattisham","AIRPORTS"
"3915","GBA","Goose Bay, AK: Goose Bay Army Air Field","AIRPORTS"
"3916","GBD","Great Bend, KS: Great Bend Municipal","AIRPORTS"
"3917","GBE","Gaborone, Botswana: Gaborone Airport","AIRPORTS"
"3918","GBG","Galesburg, IL: Galesburg Municipal","AIRPORTS"
"3919","GBH","Galbraith Lake, AK: Galbraith Lake Airport","AIRPORTS"
"3920","GBJ","Marie Galante, Guadeloupe-France: Marie Galante Airport","AIRPORTS"
"3921","GBK","Gbangbatok, Sierra Leone: Gbangbatok Airport","AIRPORTS"
"3922","GBL","Goulburn Islands, Au,","AIRPORTS"
"3923","GBR","Great Barrington, MA: Gr.Barrington","AIRPORTS"
"3924","GBT","Unknown Code Description,","AIRPORTS"
"3925","GBU","Khashm El Girba, Sudan: Khashm El Girba Airport","AIRPORTS"
"3926","GBZ","Great Barrier Island, Nz,","AIRPORTS"
"3927","GCA","Guacamayas, Colombia: Guacamayas Airport","AIRPORTS"
"3928","GCC","Gillette, WY: Gillette Campbell County","AIRPORTS"
"3929","GCI","Guernsey, United Kingdom: Guernsey Airport","AIRPORTS"
"3930","GCK","Garden City, KS: Garden City Municipal","AIRPORTS"
"3931","GCM","Grand Cayman, Cayman Islands: Owen Roberts","AIRPORTS"
"3932","GCN","Grand Canyon, AZ: Grand Canyon National","AIRPORTS"
"3933","GCR",,"AIRPORTS"
"3934","GCY","Greeneville, TN: Municipal","AIRPORTS"
"3935","GDC","Greenville/Spartanburg, SC: Donaldson Center","AIRPORTS"
"3936","GDE","Gode, Ethiopia: Gode Airport","AIRPORTS"
"3937","GDH","Golden Horn, Ak,","AIRPORTS"
"3938","GDL","Guadalajara, Mexico: Don Miguel Hidalgo International","AIRPORTS"
"3939","GDM","Gardner, MA: Gardner Municipal","AIRPORTS"
"3940","GDN","Gdansk, Poland: Gdansk Airport","AIRPORTS"
"3941","GDO","Unknown Code Description,","AIRPORTS"
"3942","GDQ","Gondar, Ethiopia: Gondar Airport","AIRPORTS"
"3943","GDT","Grand Turk, Turks and Caicos Islands-UK: Grand Turk International","AIRPORTS"
"3944","GDV","Glendive, MT: Mont  Dawson Community","AIRPORTS"
"3945","GDW","Gladwin, MI: Gladwin Airport","AIRPORTS"
"3946","GDX","Magadan, Russia (Asian): Magadan Airport","AIRPORTS"
"3947","GDZ","Gelendzik, Ru,","AIRPORTS"
"3948","GEA","Magenta, New Caledonia - France: Magenta","AIRPORTS"
"3949","GEB","Gebe, Id,","AIRPORTS"
"3950","GEC","Unknown Code Description,","AIRPORTS"
"3951","GED","Georgetown, DE: Sussex County","AIRPORTS"
"3952","GEE","George Town, Au,","AIRPORTS"
"3953","GEF","Geva, Sb,","AIRPORTS"
"3954","GEG","Spokane, WA: Spokane International","AIRPORTS"
"3955","GEK","Ganes Creek, AK: Ganes Creek Airport","AIRPORTS"
"3956","GEL","Santo Angelo, Brazil: Santo Angelo Airport","AIRPORTS"
"3957","GEN","Oslo, Norway: Gardermoen","AIRPORTS"
"3958","GEO","Georgetown, Guyana: Cheddi Jagan International","AIRPORTS"
"3959","GER","Nueva Gerona, Cuba: Nueva Gerona Airport","AIRPORTS"
"3960","GES","General Santos, Philippines: General Santos Airport","AIRPORTS"
"3961","GET","Geraldton, Australia: Geraldton Airport","AIRPORTS"
"3962","GEV","Gallivare, Sweden: Gallivare Airport","AIRPORTS"
"3963","GEW","Gewoya, Pg,","AIRPORTS"
"3964","GEX","Geelong, Au,","AIRPORTS"
"3965","GEY","Greybull, WY: So Big Horn County","AIRPORTS"
"3966","GEZ",,"AIRPORTS"
"3967","GFA","Great Falls, MT: Malmstrom Air Force Base","AIRPORTS"
"3968","GFB","Togiak Fish, AK: Togiak Fish Airport","AIRPORTS"
"3969","GFF","Griffith, Australia: Griffith Airport","AIRPORTS"
"3970","GFK","Grand Forks, ND: Grand Forks International","AIRPORTS"
"3971","GFL","Glens Falls, NY: Warren County","AIRPORTS"
"3972","GFN","Grafton, Australia: Grafton Airport","AIRPORTS"
"3973","GFO","Bartica, Guyana: Bartica Airport","AIRPORTS"
"3974","GFR","Granville, France: Granville Airport","AIRPORTS"
"3975","GFY","Grootfontein, Namibia: Grootfont","AIRPORTS"
"3976","GGE","Georgetown, SC: Georgetown County","AIRPORTS"
"3977","GGG","Longview/Kilgor/Gladwatr, TX: Gregg County","AIRPORTS"
"3978","GGN","Gagnoa, Cote d Ivoire (formerly Ivory Coast): Gagnoa Airport","AIRPORTS"
"3979","GGS","Unknown Code Description,","AIRPORTS"
"3980","GGT","George Town, Bahamas: George Town Airport","AIRPORTS"
"3981","GGW","Glasgow, MT: Glasgow International","AIRPORTS"
"3982","GHA","Ghardaia, Algeria: Ghardaia Airport","AIRPORTS"
"3983","GHB","Governors Harbour, Bahamas: Governors Harbour Airport","AIRPORTS"
"3984","GHC","Great Harbour Cay, Bahamas: Great Harbour Cay Airport","AIRPORTS"
"3985","GHD","Ghimbi, Et,","AIRPORTS"
"3986","GHE","Garachine, Pa,","AIRPORTS"
"3987","GHT","Ghat, Libya: Ghat Libya","AIRPORTS"
"3988","GHU","Gualeguaychu, Argentina: Gualeguaychu Airport","AIRPORTS"
"3989","GHX","Mildenhall, United Kingdom: Mildenhall Navy Air Field","AIRPORTS"
"3990","GIB","Gibraltar, Gibraltar-UK: Gibraltar Airport","AIRPORTS"
"3991","GIC","Boigu Island, Au,","AIRPORTS"
"3992","GIG","Rio De Janeiro, Brazil: Rio De Janeiro-Galeao International","AIRPORTS"
"3993","GIL","Gilgit, Pakistan: Gilgit Airport","AIRPORTS"
"3994","GIS","Gisborne, New Zealand: Gisborne Airport","AIRPORTS"
"3995","GIZ","Gizan, Saudi Arabia: Gizan Saudia Arabia","AIRPORTS"
"3996","GJA","Guanaja Island, Honduras: Guanaja","AIRPORTS"
"3997","GJL","Jijel, Dz,","AIRPORTS"
"3998","GJM","Guajara-Mirim, Brazil: Guajara Mirim","AIRPORTS"
"3999","GJR","Gjogur, Is,","AIRPORTS"
"4000","GJT","Grand Junction, CO: Walker Field","AIRPORTS"
"4001","GKA","Goroka, Papua New Guinea: Goroka Airport","AIRPORTS"
"4002","GKL","Great Keppel Island, Australia: Bonnie Doon","AIRPORTS"
"4003","GKN","Gulkana, AK: Gulkana Airport","AIRPORTS"
"4004","GKO","Kongo-Boumba, Gabon: Kongo-Boumba","AIRPORTS"
"4005","GL1","Station Nord, Greenland - Denmark: Station Nord Airport","AIRPORTS"
"4006","GL2","Hyde Fjord, Greenland - Denmark: Hyde Fjord Ice Strip","AIRPORTS"
"4007","GLA","Glasgow, United Kingdom: Glasgow International","AIRPORTS"
"4008","GLD","Goodland, KS: Renner Field","AIRPORTS"
"4009","GLF","Golfito, Costa Rica: Golfito 1","AIRPORTS"
"4010","GLH","Greenville, MS: Greenville Municipal","AIRPORTS"
"4011","GLI","Glen Innes, Australia: Glen Innes Airport","AIRPORTS"
"4012","GLK","Galcaio, Somalia: Galcaio Airport","AIRPORTS"
"4013","GLM","Glenormiston, Australia: Glenormiston Airport","AIRPORTS"
"4014","GLN","Goulimime, Morocco: Goulimime","AIRPORTS"
"4015","GLO","Gloucester/Cheltenham, United Kingdom: Gloucester","AIRPORTS"
"4016","GLQ","Glennallen, Ak,","AIRPORTS"
"4017","GLR","Gaylord, MI: Otsego County","AIRPORTS"
"4018","GLS","Galveston, TX: Scholes Field","AIRPORTS"
"4019","GLT","Gladstone, Australia: Gladstone Airport","AIRPORTS"
"4020","GLV","Golovin, AK: Golovin Airport","AIRPORTS"
"4021","GLW","Glasgow, KY: Glasgow Municipal","AIRPORTS"
"4022","GLX","Galela, Id,","AIRPORTS"
"4023","GMA","Gemena, Republic Of Congo: Gemena Airport","AIRPORTS"
"4024","GMB","Gambela, Et,","AIRPORTS"
"4025","GMC","Guerima, Colombia: Guerima Airport","AIRPORTS"
"4026","GME","Gomel, By,","AIRPORTS"
"4027","GMI","Gasmata, Pg,","AIRPORTS"
"4028","GMP","Seoul, South Korea: Gimpo International","AIRPORTS"
"4029","GMR","Gambier Islands, Pf,","AIRPORTS"
"4030","GMT","Granite Mountain, AK: Granite Mountain Afs","AIRPORTS"
"4031","GMU","Greenville/Spartanburg, SC: Greenville Downtown","AIRPORTS"
"4032","GMV","Monument Valley Gouldings, Ut,","AIRPORTS"
"4033","GMZ","Unknown Code Description,","AIRPORTS"
"4034","GNA","Grodno, Belarus: Grodno Airport","AIRPORTS"
"4035","GNB","Grenoble, France: Saint Greirs","AIRPORTS"
"4036","GND","St.Georges, Grenada and South Grenadines: Pearls","AIRPORTS"
"4037","GNE","Unknown Code Description,","AIRPORTS"
"4038","GNI","Green Island, Tw,","AIRPORTS"
"4039","GNL","Greenwood, MS: Greenwood Airport","AIRPORTS"
"4040","GNM","Guanambi, Br,","AIRPORTS"
"4041","GNR","General Roca, Argentina: General Roca Airport","AIRPORTS"
"4042","GNU","Goodnews Bay, AK: Goodnews","AIRPORTS"
"4043","GNV","Gainesville, FL: Gainesville Regional","AIRPORTS"
"4044","GNY","Granby, CO: Granby","AIRPORTS"
"4045","GOA","Genoa, Italy: Genova/Sestri","AIRPORTS"
"4046","GOB","Goba, Ethiopia: Goba Airport","AIRPORTS"
"4047","GOC","Gora, Pg,","AIRPORTS"
"4048","GOE","Gonalia, Pg,","AIRPORTS"
"4049","GOH","Nuuk, Greenland - Denmark: Nuuk Airport","AIRPORTS"
"4050","GOI","Goa, India: Goa/Dabolim","AIRPORTS"
"4051","GOJ","Nizhniy Novgorod, Russia (European): Nizhniy Novgorod Airport","AIRPORTS"
"4052","GOL","Gold Beach, OR: Gold Beach Municipal","AIRPORTS"
"4053","GOM","Goma, Republic Of Congo: Goma Airport","AIRPORTS"
"4054","GON","New London/Groton, CT: Trumbull","AIRPORTS"
"4055","GOO","Goondiwindi, Australia: Goondiwindi Airport","AIRPORTS"
"4056","GOP","Gorakhpur, India: Gorakhpur Airport","AIRPORTS"
"4057","GOQ","Golmud, Cn,","AIRPORTS"
"4058","GOR","Gore, Ethiopia: Gore Airport","AIRPORTS"
"4059","GOS","Gosford, Australia: Gosford Airport","AIRPORTS"
"4060","GOT","Gothenburg, Sweden: Landvetter","AIRPORTS"
"4061","GOU","Garoua, Cameroons: Garoua Airport","AIRPORTS"
"4062","GOV","Gove, Australia: Gove Airport","AIRPORTS"
"4063","GOZ","Gorna Orjahovica, Bulgaria: Gorna Orjahovica Airport","AIRPORTS"
"4064","GPA","Patrai, Gr,","AIRPORTS"
"4065","GPB","Guarapuava, Br,","AIRPORTS"
"4066","GPI","Guapi, Colombia: Guapi Airport","AIRPORTS"
"4067","GPM","Grand Prairie, TX: Grand Prairie Municipal","AIRPORTS"
"4068","GPN","Garden Point, Au,","AIRPORTS"
"4069","GPO","Unknown Code Description,","AIRPORTS"
"4070","GPS","Galapagos Islands, Ecuador: Baltra","AIRPORTS"
"4071","GPT","Gulfport/Biloxi, MS: Gulfport Municipal","AIRPORTS"
"4072","GPZ","Grand Rapids, MN: Grand Rapids Itasca County","AIRPORTS"
"4073","GQQ","Galion, OH: Horning","AIRPORTS"
"4074","GRA","Gamarra, Colombia: Gamarra East","AIRPORTS"
"4075","GRB","Green Bay/Clintonville, WI: Austin/Straubel","AIRPORTS"
